quiz_id,created_at,published_at,question,option_1,option_2,option_3,option_4,correct_option_id,correct_answer,explanation,key,level,category,logic_domain,logic_domain_secondary,core_reason,difficulty_tag,message_id,status,audio_text,audio_file_id
logik500_0349,2026-03-01T11:56:00Z,,"Die Verantwortlichkeiten waren transparent verteilt, ___ die Umsetzung beschleunigte sich deutlich.",aber,somit,oder,dennoch,1,somit,Die zweite Aussage ist die logische Wirkung der ersten.,logik500_0349_s2_b1_d6_somit_die_verantwortlichkeiten_waren_transparent,B1,Kausalität,6,2,Die zweite Aussage ist die logische Wirkung der ersten.,B1-logic-s2,,ready,,
logik500_0350,2026-03-01T11:58:00Z,,"Wesentliche Annahmen wurden getestet, ___ der Plan blieb belastbar.",oder,aber,daher,dennoch,2,daher,Die zweite Aussage ist die logische Wirkung der ersten.,logik500_0350_s2_b1_d6_daher_wesentliche_annahmen_wurden_getestet_der_p,B1,Kausalität,6,2,Die zweite Aussage ist die logische Wirkung der ersten.,B1-logic-s2,,ready,,
logik500_0351,2026-02-14T12:08:00Z,,"Die Prognosen waren pessimistisch, ___ das Quartal verlief überraschend positiv.",und,dennoch,deshalb,oder,1,dennoch,Die richtige Wahl markiert einen Erwartungsbruch.,logik500_0351_b1_d5_dennoch_die_prognosen_waren_pessimistisch_da,B1,Kontrast und Erwartung,5,6,Die richtige Wahl markiert einen Erwartungsbruch.,B1-logic,,ready,,
logik500_0352,2026-02-14T12:09:00Z,,Das Konzept wurde mehrfach kritisiert. ___ es setzte sich am Ende durch.,trotzdem,deshalb,oder,und,0,trotzdem,Die richtige Wahl markiert einen Erwartungsbruch.,logik500_0352_b1_d5_trotzdem_das_konzept_wurde_mehrfach_kritisier,B1,Kontrast und Erwartung,5,6,Die richtige Wahl markiert einen Erwartungsbruch.,B1-logic,,ready,,
logik500_0353,2026-02-14T12:10:00Z,,"Die Rahmenbedingungen waren instabil, ___ das Projekt blieb planbar.",dennoch,oder,deshalb,und,0,dennoch,Die richtige Wahl markiert einen Erwartungsbruch.,logik500_0353_b1_d5_dennoch_die_rahmenbedingungen_waren_instabil,B1,Kontrast und Erwartung,5,6,Die richtige Wahl markiert einen Erwartungsbruch.,B1-logic,,ready,,
logik500_0354,2026-02-14T12:11:00Z,,Der Markt war stark umkämpft. ___ das Unternehmen gewann neue Kunden.,oder,deshalb,trotzdem,und,2,trotzdem,Die richtige Wahl markiert einen Erwartungsbruch.,logik500_0354_b1_d5_trotzdem_der_markt_war_stark_umkaempft_das_un,B1,Kontrast und Erwartung,5,6,Die richtige Wahl markiert einen Erwartungsbruch.,B1-logic,,ready,,
logik500_0355,2026-02-14T12:12:00Z,,"Die Idee war ambitioniert, ___ die Umsetzung blieb erstaunlich pragmatisch.",und,oder,deshalb,jedoch,3,jedoch,Die richtige Wahl markiert einen Erwartungsbruch.,logik500_0355_b1_d5_jedoch_die_idee_war_ambitioniert_die_umsetz,B1,Kontrast und Erwartung,5,6,Die richtige Wahl markiert einen Erwartungsbruch.,B1-logic,,ready,,
logik500_0356,2026-02-14T12:13:00Z,,Der Zeitplan war eng. ___ die Qualität blieb konstant.,dennoch,und,oder,deshalb,0,dennoch,Die richtige Wahl markiert einen Erwartungsbruch.,logik500_0356_b1_d5_dennoch_der_zeitplan_war_eng_die_qualitaet_b,B1,Kontrast und Erwartung,5,6,Die richtige Wahl markiert einen Erwartungsbruch.,B1-logic,,ready,,
logik500_0357,2026-03-01T11:00:00Z,,"Die Marktanalyse war kritisch, ___ das Produkt startete erfolgreich.",dennoch,folglich,und,deshalb,0,dennoch,Gesucht ist ein Konnektor für Erwartungsbruch.,logik500_0357_s2_b1_d5_dennoch_die_marktanalyse_war_kritisch_das_produkt_,B1,Kontrast und Erwartung,5,6,Gesucht ist ein Konnektor für Erwartungsbruch.,B1-logic-s2,,ready,,
logik500_0358,2026-03-01T11:02:00Z,,"Mehrere Expertinnen warnten vor Risiken, ___ das Vorhaben wurde freigegeben.",und,folglich,trotzdem,deshalb,2,trotzdem,Gesucht ist ein Konnektor für Erwartungsbruch.,logik500_0358_s2_b1_d5_trotzdem_mehrere_expertinnen_warnten_vor_risiken_da,B1,Kontrast und Erwartung,5,6,Gesucht ist ein Konnektor für Erwartungsbruch.,B1-logic-s2,,ready,,
logik500_0359,2026-03-01T11:04:00Z,,"Der Zeitrahmen war eng kalkuliert, ___ die Qualität blieb konstant hoch.",und,deshalb,dennoch,folglich,2,dennoch,Gesucht ist ein Konnektor für Erwartungsbruch.,logik500_0359_s2_b1_d5_dennoch_der_zeitrahmen_war_eng_kalkuliert_die_qual,B1,Kontrast und Erwartung,5,6,Gesucht ist ein Konnektor für Erwartungsbruch.,B1-logic-s2,,ready,,
logik500_0360,2026-03-01T11:06:00Z,,"Die Ausgangslage war unsicher, ___ das Team handelte bemerkenswert strukturiert.",deshalb,und,folglich,jedoch,3,jedoch,Gesucht ist ein Konnektor für Erwartungsbruch.,logik500_0360_s2_b1_d5_jedoch_die_ausgangslage_war_unsicher_das_team_han,B1,Kontrast und Erwartung,5,6,Gesucht ist ein Konnektor für Erwartungsbruch.,B1-logic-s2,,ready,,
logik500_0361,2026-03-01T11:08:00Z,,"Das Budget wurde reduziert, ___ die wichtigsten Ziele wurden erreicht.",trotzdem,und,deshalb,folglich,0,trotzdem,Gesucht ist ein Konnektor für Erwartungsbruch.,logik500_0361_s2_b1_d5_trotzdem_das_budget_wurde_reduziert_die_wichtigsten,B1,Kontrast und Erwartung,5,6,Gesucht ist ein Konnektor für Erwartungsbruch.,B1-logic-s2,,ready,,
logik500_0362,2026-03-01T11:10:00Z,,"Die Anforderungen änderten sich mehrfach, ___ der Rollout verlief kontrolliert.",folglich,dennoch,deshalb,und,1,dennoch,Gesucht ist ein Konnektor für Erwartungsbruch.,logik500_0362_s2_b1_d5_dennoch_die_anforderungen_aenderten_sich_mehrfach_,B1,Kontrast und Erwartung,5,6,Gesucht ist ein Konnektor für Erwartungsbruch.,B1-logic-s2,,ready,,
logik500_0363,2026-03-01T11:12:00Z,,"Die Stakeholder hatten unterschiedliche Interessen, ___ es entstand ein tragfähiger Kompromiss.",folglich,jedoch,deshalb,und,1,jedoch,Gesucht ist ein Konnektor für Erwartungsbruch.,logik500_0363_s2_b1_d5_jedoch_die_stakeholder_hatten_unterschiedliche_in,B1,Kontrast und Erwartung,5,6,Gesucht ist ein Konnektor für Erwartungsbruch.,B1-logic-s2,,ready,,
logik500_0364,2026-03-01T11:14:00Z,,"Der Wettbewerbsdruck war hoch, ___ die Kundenzufriedenheit stieg.",folglich,deshalb,und,trotzdem,3,trotzdem,Gesucht ist ein Konnektor für Erwartungsbruch.,logik500_0364_s2_b1_d5_trotzdem_der_wettbewerbsdruck_war_hoch_die_kundenzu,B1,Kontrast und Erwartung,5,6,Gesucht ist ein Konnektor für Erwartungsbruch.,B1-logic-s2,,ready,,
logik500_0365,2026-03-01T11:16:00Z,,"Es gab anfangs deutliche Skepsis, ___ die Lösung setzte sich intern durch.",folglich,dennoch,deshalb,und,1,dennoch,Gesucht ist ein Konnektor für Erwartungsbruch.,logik500_0365_s2_b1_d5_dennoch_es_gab_anfangs_deutliche_skepsis_die_loesu,B1,Kontrast und Erwartung,5,6,Gesucht ist ein Konnektor für Erwartungsbruch.,B1-logic-s2,,ready,,
logik500_0366,2026-03-01T11:18:00Z,,"Die Ressourcen waren knapp, ___ das Team lieferte termingerecht.",und,trotzdem,deshalb,folglich,1,trotzdem,Gesucht ist ein Konnektor für Erwartungsbruch.,logik500_0366_s2_b1_d5_trotzdem_die_ressourcen_waren_knapp_das_team_liefer,B1,Kontrast und Erwartung,5,6,Gesucht ist ein Konnektor für Erwartungsbruch.,B1-logic-s2,,ready,,
logik500_0367,2026-02-14T15:28:00Z,,"Die Daten sind plausibel, aber ___ vollständig.",kein,nicht,nie,nichts,1,nicht,Hier wird ein Adjektiv/Prädikat verneint.,logik500_0367_b1_d10_nicht_die_daten_sind_plausibel_aber_vollst,B1,Minimaler Kontext,10,1,Hier wird ein Adjektiv/Prädikat verneint.,B1-logic,,ready,,
logik500_0368,2026-02-14T15:29:00Z,,Nur ein Signalwort ist logisch: Im Bericht steht ___ zur Ursache des Fehlers.,nie,nicht,kein,nichts,3,nichts,Es geht um fehlende Information.,logik500_0368_b1_d10_nichts_nur_ein_signalwort_ist_logisch_im_be,B1,Minimaler Kontext,10,1,Es geht um fehlende Information.,B1-logic,,ready,,
logik500_0369,2026-02-14T15:30:00Z,,"Wir können ___ Verantwortung übernehmen, wenn Fakten fehlen.",nichts,nie,nicht,keine,3,keine,"Verneint wird das Nomen ""Verantwortung"".",logik500_0369_b1_d10_keine_wir_koennen_verantwortung_uebernehme,B1,Minimaler Kontext,10,1,"Verneint wird das Nomen ""Verantwortung"".",B1-logic,,ready,,
logik500_0370,2026-02-14T15:31:00Z,,"Nur ein Signalwort ist logisch: Der Effekt tritt ___ sofort ein, sondern verzögert.",kein,nie,nichts,nicht,3,nicht,"Der Kontrast ""sondern"" fordert ""nicht"".",logik500_0370_b1_d10_nicht_nur_ein_signalwort_ist_logisch_der_e,B1,Minimaler Kontext,10,1,"Der Kontrast ""sondern"" fordert ""nicht"".",B1-logic,,ready,,
logik500_0371,2026-02-14T15:32:00Z,,In dieser Form ist der Plan ___ tragfähig.,nichts,nicht,nie,kein,1,nicht,Die Aussage bewertet die Tragfähigkeit negativ.,logik500_0371_b1_d10_nicht_in_dieser_form_ist_der_plan_tragfaeh,B1,Minimaler Kontext,10,1,Die Aussage bewertet die Tragfähigkeit negativ.,B1-logic,,ready,,
logik500_0372,2026-02-14T15:33:00Z,,Nur ein Signalwort ist logisch: Ohne Rückmeldung können wir ___ priorisieren.,nicht,kein,nie,nichts,3,nichts,Es fehlt die Basis für inhaltliche Priorisierung.,logik500_0372_b1_d10_nichts_nur_ein_signalwort_ist_logisch_ohne_,B1,Minimaler Kontext,10,1,Es fehlt die Basis für inhaltliche Priorisierung.,B1-logic,,ready,,
logik500_0373,2026-02-14T15:35:00Z,,Signalwort im Kontext: Im Bericht steht ___ zur Ursache des Fehlers.,nichts,nie,kein,nicht,0,nichts,Es geht um fehlende Information.,logik500_0373_b1_d10_nichts_signalwort_im_kontext_im_bericht_ste,B1,Minimaler Kontext,10,1,Es geht um fehlende Information.,B1-logic,,ready,,
logik500_0374,2026-02-14T15:37:00Z,,"Signalwort im Kontext: Der Effekt tritt ___ sofort ein, sondern verzögert.",nicht,kein,nichts,nie,0,nicht,"Der Kontrast ""sondern"" fordert ""nicht"".",logik500_0374_b1_d10_nicht_signalwort_im_kontext_der_effekt_tri,B1,Minimaler Kontext,10,1,"Der Kontrast ""sondern"" fordert ""nicht"".",B1-logic,,ready,,
logik500_0375,2026-02-14T15:39:00Z,,Signalwort im Kontext: Ohne Rückmeldung können wir ___ priorisieren.,nie,nichts,kein,nicht,1,nichts,Es fehlt die Basis für inhaltliche Priorisierung.,logik500_0375_b1_d10_nichts_signalwort_im_kontext_ohne_rueckmeld,B1,Minimaler Kontext,10,1,Es fehlt die Basis für inhaltliche Priorisierung.,B1-logic,,ready,,
logik500_0376,2026-03-01T14:20:00Z,,"Minimaler Kontext B1: Die Aussage wirkt plausibel, ist aber fachlich ___ belastbar.",nicht,nie,nichts,kein,0,nicht,Hier wird ein Prädikat verneint.,logik500_0376_s2_b1_d10_nicht_minimaler_kontext_b1_die_aussage_wirkt_pla,B1,Minimaler Kontext,10,1,Hier wird ein Prädikat verneint.,B1-logic-s2,,ready,,
logik500_0377,2026-03-01T14:21:00Z,,"Kontext entscheidet: Die Aussage wirkt plausibel, ist aber fachlich ___ belastbar.",kein,nicht,nichts,nie,1,nicht,Hier wird ein Prädikat verneint.,logik500_0377_s2_b1_d10_nicht_kontext_entscheidet_die_aussage_wirkt_plau,B1,Minimaler Kontext,10,1,Hier wird ein Prädikat verneint.,B1-logic-s2,,ready,,
logik500_0378,2026-03-01T14:22:00Z,,Minimaler Kontext B1: Ohne belastbare Daten können wir ___ priorisieren.,kein,nichts,nie,nicht,1,nichts,Es fehlt die Grundlage für inhaltliche Priorisierung.,logik500_0378_s2_b1_d10_nichts_minimaler_kontext_b1_ohne_belastbare_daten,B1,Minimaler Kontext,10,1,Es fehlt die Grundlage für inhaltliche Priorisierung.,B1-logic-s2,,ready,,
logik500_0379,2026-03-01T14:23:00Z,,Kontext entscheidet: Ohne belastbare Daten können wir ___ priorisieren.,nicht,kein,nichts,nie,2,nichts,Es fehlt die Grundlage für inhaltliche Priorisierung.,logik500_0379_s2_b1_d10_nichts_kontext_entscheidet_ohne_belastbare_daten_,B1,Minimaler Kontext,10,1,Es fehlt die Grundlage für inhaltliche Priorisierung.,B1-logic-s2,,ready,,
logik500_0380,2026-03-01T14:24:00Z,,Minimaler Kontext B1: In dieser Form übernimmt das Team ___ Verantwortung.,nicht,nie,keine,nichts,2,keine,Das Nomen „Verantwortung“ wird verneint.,logik500_0380_s2_b1_d10_keine_minimaler_kontext_b1_in_dieser_form_uebern,B1,Minimaler Kontext,10,1,Das Nomen „Verantwortung“ wird verneint.,B1-logic-s2,,ready,,
logik500_0381,2026-03-01T14:25:00Z,,Kontext entscheidet: In dieser Form übernimmt das Team ___ Verantwortung.,nicht,nie,keine,nichts,2,keine,Das Nomen „Verantwortung“ wird verneint.,logik500_0381_s2_b1_d10_keine_kontext_entscheidet_in_dieser_form_ueberni,B1,Minimaler Kontext,10,1,Das Nomen „Verantwortung“ wird verneint.,B1-logic-s2,,ready,,
logik500_0382,2026-03-01T14:26:00Z,,"Minimaler Kontext B1: Der Effekt tritt ___ sofort ein, sondern erst später.",nicht,kein,nichts,nie,0,nicht,Mit „sondern“ passt logisch „nicht“.,logik500_0382_s2_b1_d10_nicht_minimaler_kontext_b1_der_effekt_tritt_sofo,B1,Minimaler Kontext,10,1,Mit „sondern“ passt logisch „nicht“.,B1-logic-s2,,ready,,
logik500_0383,2026-03-01T14:27:00Z,,"Kontext entscheidet: Der Effekt tritt ___ sofort ein, sondern erst später.",nichts,nie,kein,nicht,3,nicht,Mit „sondern“ passt logisch „nicht“.,logik500_0383_s2_b1_d10_nicht_kontext_entscheidet_der_effekt_tritt_sofor,B1,Minimaler Kontext,10,1,Mit „sondern“ passt logisch „nicht“.,B1-logic-s2,,ready,,
logik500_0384,2026-03-01T14:28:00Z,,Minimaler Kontext B1: Im aktuellen Entwurf steht ___ zu den Folgekosten.,kein,nicht,nichts,nie,2,nichts,Es fehlt Information zu Folgekosten.,logik500_0384_s2_b1_d10_nichts_minimaler_kontext_b1_im_aktuellen_entwurf_,B1,Minimaler Kontext,10,1,Es fehlt Information zu Folgekosten.,B1-logic-s2,,ready,,
logik500_0385,2026-03-01T14:29:00Z,,Kontext entscheidet: Im aktuellen Entwurf steht ___ zu den Folgekosten.,nichts,kein,nicht,nie,0,nichts,Es fehlt Information zu Folgekosten.,logik500_0385_s2_b1_d10_nichts_kontext_entscheidet_im_aktuellen_entwurf_s,B1,Minimaler Kontext,10,1,Es fehlt Information zu Folgekosten.,B1-logic-s2,,ready,,
logik500_0386,2026-03-01T14:30:00Z,,Minimaler Kontext B1: Unter diesen Bedingungen ist die Lösung ___ tragfähig.,kein,nicht,nie,nichts,1,nicht,Die Tragfähigkeit wird negiert.,logik500_0386_s2_b1_d10_nicht_minimaler_kontext_b1_unter_diesen_bedingun,B1,Minimaler Kontext,10,1,Die Tragfähigkeit wird negiert.,B1-logic-s2,,ready,,
logik500_0387,2026-03-01T14:31:00Z,,Kontext entscheidet: Unter diesen Bedingungen ist die Lösung ___ tragfähig.,kein,nichts,nicht,nie,2,nicht,Die Tragfähigkeit wird negiert.,logik500_0387_s2_b1_d10_nicht_kontext_entscheidet_unter_diesen_bedingung,B1,Minimaler Kontext,10,1,Die Tragfähigkeit wird negiert.,B1-logic-s2,,ready,,
logik500_0388,2026-03-01T14:32:00Z,,Minimaler Kontext B1: Bis jetzt hat ___ aus dem Team widersprochen.,nicht,niemand,kein,nichts,1,niemand,Gesucht ist eine Person.,logik500_0388_s2_b1_d10_niemand_minimaler_kontext_b1_bis_jetzt_hat_aus_dem,B1,Minimaler Kontext,10,1,Gesucht ist eine Person.,B1-logic-s2,,ready,,
logik500_0389,2026-03-01T14:33:00Z,,Kontext entscheidet: Bis jetzt hat ___ aus dem Team widersprochen.,kein,nicht,niemand,nichts,2,niemand,Gesucht ist eine Person.,logik500_0389_s2_b1_d10_niemand_kontext_entscheidet_bis_jetzt_hat_aus_dem_,B1,Minimaler Kontext,10,1,Gesucht ist eine Person.,B1-logic-s2,,ready,,
logik500_0390,2026-03-01T14:34:00Z,,Minimaler Kontext B1: Ohne klare Kriterien gibt es ___ faire Entscheidung.,nicht,nichts,keine,nie,2,keine,Das Nomen „Entscheidung“ wird verneint.,logik500_0390_s2_b1_d10_keine_minimaler_kontext_b1_ohne_klare_kriterien_,B1,Minimaler Kontext,10,1,Das Nomen „Entscheidung“ wird verneint.,B1-logic-s2,,ready,,
logik500_0391,2026-03-01T14:35:00Z,,Kontext entscheidet: Ohne klare Kriterien gibt es ___ faire Entscheidung.,nicht,nichts,keine,nie,2,keine,Das Nomen „Entscheidung“ wird verneint.,logik500_0391_s2_b1_d10_keine_kontext_entscheidet_ohne_klare_kriterien_g,B1,Minimaler Kontext,10,1,Das Nomen „Entscheidung“ wird verneint.,B1-logic-s2,,ready,,
logik500_0392,2026-03-01T14:36:00Z,,"Minimaler Kontext B1: Der Plan ist ambitioniert, aber aktuell ___ realistisch.",nie,nichts,nicht,kein,2,nicht,Hier wird ein Adjektiv verneint.,logik500_0392_s2_b1_d10_nicht_minimaler_kontext_b1_der_plan_ist_ambition,B1,Minimaler Kontext,10,1,Hier wird ein Adjektiv verneint.,B1-logic-s2,,ready,,
logik500_0393,2026-03-01T14:37:00Z,,"Kontext entscheidet: Der Plan ist ambitioniert, aber aktuell ___ realistisch.",nie,nicht,nichts,kein,1,nicht,Hier wird ein Adjektiv verneint.,logik500_0393_s2_b1_d10_nicht_kontext_entscheidet_der_plan_ist_ambitioni,B1,Minimaler Kontext,10,1,Hier wird ein Adjektiv verneint.,B1-logic-s2,,ready,,
logik500_0394,2026-03-01T14:38:00Z,,Minimaler Kontext B1: Im Bericht findet sich ___ Hinweis auf das Hauptrisiko.,kein,nicht,nichts,nie,0,kein,Nomen im Singular wird mit „kein“ verneint.,logik500_0394_s2_b1_d10_kein_minimaler_kontext_b1_im_bericht_findet_sic,B1,Minimaler Kontext,10,1,Nomen im Singular wird mit „kein“ verneint.,B1-logic-s2,,ready,,
logik500_0395,2026-03-01T14:39:00Z,,Kontext entscheidet: Im Bericht findet sich ___ Hinweis auf das Hauptrisiko.,nicht,kein,nichts,nie,1,kein,Nomen im Singular wird mit „kein“ verneint.,logik500_0395_s2_b1_d10_kein_kontext_entscheidet_im_bericht_findet_sich,B1,Minimaler Kontext,10,1,Nomen im Singular wird mit „kein“ verneint.,B1-logic-s2,,ready,,
logik500_0396,2026-02-14T09:28:00Z,,"Für diese Rolle brauchst du jemanden, der auch unter Druck ___.",früh geht,spät kommt,belastbar bleibt,laut lacht,2,belastbar bleibt,Die Rolle verlangt Stabilität unter Druck.,logik500_0396_b1_d1_belastbar_bleibt_fuer_diese_rolle_brauchst_du_jemande,B1,Semantische Logik,1,10,Die Rolle verlangt Stabilität unter Druck.,B1-logic,,ready,,
logik500_0397,2026-02-14T09:29:00Z,,"Inhaltlich stimmig ergänzen: Die Strategie klingt gut, aber ohne klare Schritte ist sie schwer ___.",abzuzählen,aufzuessen,umzusetzen,anzuziehen,2,umzusetzen,Strategien setzt man um.,logik500_0397_b1_d1_umzusetzen_inhaltlich_stimmig_ergaenzen_die_str,B1,Semantische Logik,1,10,Strategien setzt man um.,B1-logic,,ready,,
logik500_0398,2026-02-14T09:30:00Z,,"Im Bericht sollten wir Risiken nicht nur nennen, sondern auch ___",streichen,bewerten,färben,falten,1,bewerten,Risiken müssen inhaltlich bewertet werden.,logik500_0398_b1_d1_bewerten_im_bericht_sollten_wir_risiken_nicht,B1,Semantische Logik,1,10,Risiken müssen inhaltlich bewertet werden.,B1-logic,,ready,,
logik500_0399,2026-02-14T09:31:00Z,,"Inhaltlich stimmig ergänzen: Die Entscheidung war emotional verständlich, aber fachlich schwer ___.",eckig,bunt,nachvollziehbar,zugänglich,2,nachvollziehbar,Es geht um fachliche Nachvollziehbarkeit.,logik500_0399_b1_d1_nachvollziehbar_inhaltlich_stimmig_ergaenzen_die_ent,B1,Semantische Logik,1,10,Es geht um fachliche Nachvollziehbarkeit.,B1-logic,,ready,,
logik500_0400,2026-02-14T09:32:00Z,,Für eine faire Diskussion müssen wir verschiedene Perspektiven ___.,aufräumen,berücksichtigen,wegwerfen,abkühlen,1,berücksichtigen,Fairness entsteht durch Einbezug mehrerer Perspektiven.,logik500_0400_b1_d1_beruecksichtigen_fuer_eine_faire_diskussion_muessen_w,B1,Semantische Logik,1,10,Fairness entsteht durch Einbezug mehrerer Perspektiven.,B1-logic,,ready,,
logik500_0401,2026-02-14T09:33:00Z,,"Inhaltlich stimmig ergänzen: Der Vorschlag ist nur dann hilfreich, wenn er klar und ___.",weich ist,zielführend ist,glänzend ist,billig ist,1,zielführend ist,"Hilfreich ist ein Vorschlag, wenn er zum Ziel führt.",logik500_0401_b1_d1_zielfuehrend_ist_inhaltlich_stimmig_ergaenzen_der_vor,B1,Semantische Logik,1,10,"Hilfreich ist ein Vorschlag, wenn er zum Ziel führt.",B1-logic,,ready,,
logik500_0402,2026-03-01T08:20:00Z,,"Semantisch präzise ergänzen: Die Kennzahlen wirken stabil, trotzdem müssen wir die Entwicklung weiter ___.",falten,lackieren,grillen,beobachten,3,beobachten,Stabile Zahlen brauchen weiterhin Beobachtung.,logik500_0402_s2_b1_d1_beobachten_semantisch_praezise_ergaenzen_die_kennzahl,B1,Semantische Logik,1,10,Stabile Zahlen brauchen weiterhin Beobachtung.,B1-logic-s2,,ready,,
logik500_0403,2026-03-01T08:21:00Z,,"Was ist inhaltlich stimmig? Die Kennzahlen wirken stabil, trotzdem müssen wir die Entwicklung weiter ___.",grillen,lackieren,falten,beobachten,3,beobachten,Stabile Zahlen brauchen weiterhin Beobachtung.,logik500_0403_s2_b1_d1_beobachten_was_ist_inhaltlich_stimmig_die_kennzahlen_,B1,Semantische Logik,1,10,Stabile Zahlen brauchen weiterhin Beobachtung.,B1-logic-s2,,ready,,
logik500_0404,2026-03-01T08:22:00Z,,"Semantisch präzise ergänzen: Ein überzeugendes Konzept muss nicht nur kreativ, sondern auch praktisch ___.",laut sein,umsetzbar sein,teuer sein,weich sein,1,umsetzbar sein,Gute Konzepte müssen realisierbar sein.,logik500_0404_s2_b1_d1_umsetzbar_sein_semantisch_praezise_ergaenzen_ein_ueberzeu,B1,Semantische Logik,1,10,Gute Konzepte müssen realisierbar sein.,B1-logic-s2,,ready,,
logik500_0405,2026-03-01T08:23:00Z,,"Was ist inhaltlich stimmig? Ein überzeugendes Konzept muss nicht nur kreativ, sondern auch praktisch ___.",umsetzbar sein,teuer sein,laut sein,weich sein,0,umsetzbar sein,Gute Konzepte müssen realisierbar sein.,logik500_0405_s2_b1_d1_umsetzbar_sein_was_ist_inhaltlich_stimmig_ein_ueberzeugen,B1,Semantische Logik,1,10,Gute Konzepte müssen realisierbar sein.,B1-logic-s2,,ready,,
logik500_0406,2026-03-01T08:24:00Z,,"Semantisch präzise ergänzen: Wenn Annahmen unsicher sind, sollten wir sie mit Daten ___.",vergraben,verdünnen,bemalen,validieren,3,validieren,Unsichere Annahmen werden validiert.,logik500_0406_s2_b1_d1_validieren_semantisch_praezise_ergaenzen_wenn_annahme,B1,Semantische Logik,1,10,Unsichere Annahmen werden validiert.,B1-logic-s2,,ready,,
logik500_0407,2026-03-01T08:25:00Z,,"Was ist inhaltlich stimmig? Wenn Annahmen unsicher sind, sollten wir sie mit Daten ___.",validieren,vergraben,bemalen,verdünnen,0,validieren,Unsichere Annahmen werden validiert.,logik500_0407_s2_b1_d1_validieren_was_ist_inhaltlich_stimmig_wenn_annahmen_u,B1,Semantische Logik,1,10,Unsichere Annahmen werden validiert.,B1-logic-s2,,ready,,
logik500_0408,2026-03-01T08:26:00Z,,"Semantisch präzise ergänzen: Eine Maßnahme ist nur sinnvoll, wenn sie das Hauptproblem wirklich ___.",verdampft,verziert,vermehrt,adressiert,3,adressiert,Sinnvolle Maßnahmen treffen die Kernursache.,logik500_0408_s2_b1_d1_adressiert_semantisch_praezise_ergaenzen_eine_massnah,B1,Semantische Logik,1,10,Sinnvolle Maßnahmen treffen die Kernursache.,B1-logic-s2,,ready,,
logik500_0409,2026-03-01T08:27:00Z,,"Was ist inhaltlich stimmig? Eine Maßnahme ist nur sinnvoll, wenn sie das Hauptproblem wirklich ___.",adressiert,verziert,verdampft,vermehrt,0,adressiert,Sinnvolle Maßnahmen treffen die Kernursache.,logik500_0409_s2_b1_d1_adressiert_was_ist_inhaltlich_stimmig_eine_massnahme_,B1,Semantische Logik,1,10,Sinnvolle Maßnahmen treffen die Kernursache.,B1-logic-s2,,ready,,
logik500_0410,2026-03-01T08:28:00Z,,Semantisch präzise ergänzen: Für belastbare Ergebnisse müssen wir methodisch sauber ___.,umziehen,arbeiten,spazieren,einkaufen,1,arbeiten,Belastbarkeit entsteht durch methodisches Arbeiten.,logik500_0410_s2_b1_d1_arbeiten_semantisch_praezise_ergaenzen_fuer_belastb,B1,Semantische Logik,1,10,Belastbarkeit entsteht durch methodisches Arbeiten.,B1-logic-s2,,ready,,
logik500_0411,2026-03-01T08:29:00Z,,Was ist inhaltlich stimmig? Für belastbare Ergebnisse müssen wir methodisch sauber ___.,umziehen,spazieren,arbeiten,einkaufen,2,arbeiten,Belastbarkeit entsteht durch methodisches Arbeiten.,logik500_0411_s2_b1_d1_arbeiten_was_ist_inhaltlich_stimmig_fuer_belastbare,B1,Semantische Logik,1,10,Belastbarkeit entsteht durch methodisches Arbeiten.,B1-logic-s2,,ready,,
logik500_0412,2026-03-01T08:30:00Z,,"Semantisch präzise ergänzen: Bevor wir skalieren, sollten wir den Prozess im Kleinen ___.",testen,heben,streuen,fegen,0,testen,Skalierung ohne Test erhöht das Risiko.,logik500_0412_s2_b1_d1_testen_semantisch_praezise_ergaenzen_bevor_wir_sk,B1,Semantische Logik,1,10,Skalierung ohne Test erhöht das Risiko.,B1-logic-s2,,ready,,
logik500_0413,2026-03-01T08:31:00Z,,"Was ist inhaltlich stimmig? Bevor wir skalieren, sollten wir den Prozess im Kleinen ___.",streuen,testen,fegen,heben,1,testen,Skalierung ohne Test erhöht das Risiko.,logik500_0413_s2_b1_d1_testen_was_ist_inhaltlich_stimmig_bevor_wir_skali,B1,Semantische Logik,1,10,Skalierung ohne Test erhöht das Risiko.,B1-logic-s2,,ready,,
logik500_0414,2026-03-01T08:32:00Z,,"Semantisch präzise ergänzen: Wenn Ziele konkurrieren, müssen Prioritäten transparent ___.",gesungen werden,gewaschen werden,gesetzt werden,gekocht werden,2,gesetzt werden,Konfliktende Ziele brauchen klare Prioritätensetzung.,logik500_0414_s2_b1_d1_gesetzt_werden_semantisch_praezise_ergaenzen_wenn_ziele_k,B1,Semantische Logik,1,10,Konfliktende Ziele brauchen klare Prioritätensetzung.,B1-logic-s2,,ready,,
logik500_0415,2026-03-01T08:33:00Z,,"Was ist inhaltlich stimmig? Wenn Ziele konkurrieren, müssen Prioritäten transparent ___.",gewaschen werden,gesungen werden,gekocht werden,gesetzt werden,3,gesetzt werden,Konfliktende Ziele brauchen klare Prioritätensetzung.,logik500_0415_s2_b1_d1_gesetzt_werden_was_ist_inhaltlich_stimmig_wenn_ziele_konk,B1,Semantische Logik,1,10,Konfliktende Ziele brauchen klare Prioritätensetzung.,B1-logic-s2,,ready,,
logik500_0416,2026-03-01T08:34:00Z,,"Semantisch präzise ergänzen: Ein Bericht ist nur hilfreich, wenn Schlussfolgerungen klar ___.",beleuchtet sind,gebügelt sind,gestrichen sind,begründet sind,3,begründet sind,Nützliche Berichte benötigen nachvollziehbare Begründungen.,logik500_0416_s2_b1_d1_begruendet_sind_semantisch_praezise_ergaenzen_ein_bericht_,B1,Semantische Logik,1,10,Nützliche Berichte benötigen nachvollziehbare Begründungen.,B1-logic-s2,,ready,,
logik500_0417,2026-03-01T08:35:00Z,,"Was ist inhaltlich stimmig? Ein Bericht ist nur hilfreich, wenn Schlussfolgerungen klar ___.",beleuchtet sind,gestrichen sind,gebügelt sind,begründet sind,3,begründet sind,Nützliche Berichte benötigen nachvollziehbare Begründungen.,logik500_0417_s2_b1_d1_begruendet_sind_was_ist_inhaltlich_stimmig_ein_bericht_ist,B1,Semantische Logik,1,10,Nützliche Berichte benötigen nachvollziehbare Begründungen.,B1-logic-s2,,ready,,
