quiz_id,created_at,published_at,question,option_1,option_2,option_3,option_4,correct_option_id,correct_answer,explanation,key,level,category,logic_domain,logic_domain_secondary,core_reason,difficulty_tag,message_id,status,audio_text,audio_file_id
logik500_0142,2026-02-14T11:58:00Z,,"Die Strecke war lang, ___ sie wirkte am Ende entspannt.",deshalb,und,oder,dennoch,3,dennoch,Hier zählt der Kontrast zwischen Erwartung und Ergebnis.,logik500_0142_a2_d5_dennoch_die_strecke_war_lang_sie_wirkte_am_e,A2,Kontrast und Erwartung,5,6,Hier zählt der Kontrast zwischen Erwartung und Ergebnis.,A2-logic,,ready,,
logik500_0143,2026-02-14T11:59:00Z,,Der Preis war hoch. ___ das Produkt war sofort ausverkauft.,oder,trotzdem,deshalb,und,1,trotzdem,Hier zählt der Kontrast zwischen Erwartung und Ergebnis.,logik500_0143_a2_d5_trotzdem_der_preis_war_hoch_das_produkt_war_s,A2,Kontrast und Erwartung,5,6,Hier zählt der Kontrast zwischen Erwartung und Ergebnis.,A2-logic,,ready,,
logik500_0144,2026-03-01T10:40:00Z,,"Der Weg war weit, ___ wir waren pünktlich.",und,deshalb,oder,trotzdem,3,trotzdem,Die zweite Aussage widerspricht der Erwartung.,logik500_0144_s2_a2_d5_trotzdem_der_weg_war_weit_wir_waren_puenktlich,A2,Kontrast und Erwartung,5,6,Die zweite Aussage widerspricht der Erwartung.,A2-logic-s2,,ready,,
logik500_0145,2026-03-01T10:42:00Z,,"Die Anleitung war kurz, ___ sie war sehr hilfreich.",deshalb,oder,und,aber,3,aber,Die zweite Aussage widerspricht der Erwartung.,logik500_0145_s2_a2_d5_aber_die_anleitung_war_kurz_sie_war_sehr_hilfre,A2,Kontrast und Erwartung,5,6,Die zweite Aussage widerspricht der Erwartung.,A2-logic-s2,,ready,,
logik500_0146,2026-03-01T10:44:00Z,,"Er hatte wenig Schlaf, ___ er blieb den ganzen Tag konzentriert.",und,dennoch,oder,deshalb,1,dennoch,Die zweite Aussage widerspricht der Erwartung.,logik500_0146_s2_a2_d5_dennoch_er_hatte_wenig_schlaf_er_blieb_den_ganzen_,A2,Kontrast und Erwartung,5,6,Die zweite Aussage widerspricht der Erwartung.,A2-logic-s2,,ready,,
logik500_0147,2026-03-01T10:46:00Z,,"Die Aufgabe wirkte einfach, ___ sie brauchte viel Zeit.",oder,und,deshalb,aber,3,aber,Die zweite Aussage widerspricht der Erwartung.,logik500_0147_s2_a2_d5_aber_die_aufgabe_wirkte_einfach_sie_brauchte_vi,A2,Kontrast und Erwartung,5,6,Die zweite Aussage widerspricht der Erwartung.,A2-logic-s2,,ready,,
logik500_0148,2026-03-01T10:48:00Z,,"Es war kalt im Raum, ___ alle arbeiteten ruhig weiter.",und,oder,deshalb,trotzdem,3,trotzdem,Die zweite Aussage widerspricht der Erwartung.,logik500_0148_s2_a2_d5_trotzdem_es_war_kalt_im_raum_alle_arbeiteten_ruhig_,A2,Kontrast und Erwartung,5,6,Die zweite Aussage widerspricht der Erwartung.,A2-logic-s2,,ready,,
logik500_0149,2026-03-01T10:50:00Z,,"Der Preis war hoch, ___ das Produkt war schnell ausverkauft.",deshalb,oder,und,dennoch,3,dennoch,Die zweite Aussage widerspricht der Erwartung.,logik500_0149_s2_a2_d5_dennoch_der_preis_war_hoch_das_produkt_war_schnell,A2,Kontrast und Erwartung,5,6,Die zweite Aussage widerspricht der Erwartung.,A2-logic-s2,,ready,,
logik500_0150,2026-03-01T10:52:00Z,,"Die Verbindung war instabil, ___ das Gespräch verlief klar.",und,oder,deshalb,trotzdem,3,trotzdem,Die zweite Aussage widerspricht der Erwartung.,logik500_0150_s2_a2_d5_trotzdem_die_verbindung_war_instabil_das_gespraech_,A2,Kontrast und Erwartung,5,6,Die zweite Aussage widerspricht der Erwartung.,A2-logic-s2,,ready,,
logik500_0151,2026-03-01T10:54:00Z,,"Wir hatten einen Plan, ___ es gab Missverständnisse.",aber,deshalb,oder,und,0,aber,Die zweite Aussage widerspricht der Erwartung.,logik500_0151_s2_a2_d5_aber_wir_hatten_einen_plan_es_gab_missverstaend,A2,Kontrast und Erwartung,5,6,Die zweite Aussage widerspricht der Erwartung.,A2-logic-s2,,ready,,
logik500_0152,2026-03-01T10:56:00Z,,"Sie war nervös vor dem Vortrag, ___ sie sprach sehr souverän.",und,oder,dennoch,deshalb,2,dennoch,Die zweite Aussage widerspricht der Erwartung.,logik500_0152_s2_a2_d5_dennoch_sie_war_nervoes_vor_dem_vortrag_sie_sprach,A2,Kontrast und Erwartung,5,6,Die zweite Aussage widerspricht der Erwartung.,A2-logic-s2,,ready,,
logik500_0153,2026-03-01T10:58:00Z,,"Das Wetter war schlecht, ___ die Veranstaltung war gut besucht.",und,trotzdem,oder,deshalb,1,trotzdem,Die zweite Aussage widerspricht der Erwartung.,logik500_0153_s2_a2_d5_trotzdem_das_wetter_war_schlecht_die_veranstaltung_,A2,Kontrast und Erwartung,5,6,Die zweite Aussage widerspricht der Erwartung.,A2-logic-s2,,ready,,
logik500_0154,2026-02-14T15:12:00Z,,"Die Sitzung ist ___ beendet, wir brauchen fünf Minuten.",nichts,kein,noch nicht,nie,2,noch nicht,Der Kontext zeigt: Der Zustand gilt noch nicht.,logik500_0154_a2_d10_noch_nicht_die_sitzung_ist_beendet_wir_brauchen,A2,Minimaler Kontext,10,1,Der Kontext zeigt: Der Zustand gilt noch nicht.,A2-logic,,ready,,
logik500_0155,2026-02-14T15:13:00Z,,"Minimaler Kontext: Ich habe den Bericht gelesen, aber ___ verstanden.",nicht,nichts,nie,kein,1,nichts,Die Bedeutung betrifft den Umfang des Verstehens.,logik500_0155_a2_d10_nichts_minimaler_kontext_ich_habe_den_beric,A2,Minimaler Kontext,10,1,Die Bedeutung betrifft den Umfang des Verstehens.,A2-logic,,ready,,
logik500_0156,2026-02-14T15:14:00Z,,Er antwortet fast ___ auf Nachrichten.,nichts,nicht,nie,kein,2,nie,Es geht um Häufigkeit.,logik500_0156_a2_d10_nie_er_antwortet_fast_auf_nachrichten,A2,Minimaler Kontext,10,1,Es geht um Häufigkeit.,A2-logic,,ready,,
logik500_0157,2026-02-14T15:15:00Z,,Minimaler Kontext: Wir haben ___ offenen Punkte mehr.,nie,keine,nichts,nicht,1,keine,Hier wird ein Pluralnomen verneint.,logik500_0157_a2_d10_keine_minimaler_kontext_wir_haben_offenen_,A2,Minimaler Kontext,10,1,Hier wird ein Pluralnomen verneint.,A2-logic,,ready,,
logik500_0158,2026-02-14T15:16:00Z,,Im Protokoll fehlt ___ wichtiger Hinweis.,ein,nicht,kein,nie,0,ein,Der Kontext fordert das Vorhandensein eines Hinweises.,logik500_0158_a2_d10_ein_im_protokoll_fehlt_wichtiger_hinweis,A2,Minimaler Kontext,10,1,Der Kontext fordert das Vorhandensein eines Hinweises.,A2-logic,,ready,,
logik500_0159,2026-02-14T15:17:00Z,,"Minimaler Kontext: Sie hat heute ___ Stimme, deshalb schreibt sie nur.",nicht,keine,nie,nichts,1,keine,"Die Aussage verneint das Nomen ""Stimme"".",logik500_0159_a2_d10_keine_minimaler_kontext_sie_hat_heute_stim,A2,Minimaler Kontext,10,1,"Die Aussage verneint das Nomen ""Stimme"".",A2-logic,,ready,,
logik500_0160,2026-02-14T15:18:00Z,,"Der Kunde war da, aber er hat ___ unterschrieben.",nichts,nicht,nie,kein,0,nichts,Es wird die Handlungsergebnissebene verneint.,logik500_0160_a2_d10_nichts_der_kunde_war_da_aber_er_hat_untersc,A2,Minimaler Kontext,10,1,Es wird die Handlungsergebnissebene verneint.,A2-logic,,ready,,
logik500_0161,2026-02-14T15:19:00Z,,Minimaler Kontext: Bis jetzt hat sich ___ beschwert.,nicht,kein,nichts,niemand,3,niemand,"Gesucht ist eine Person, nicht ein Ding.",logik500_0161_a2_d10_niemand_minimaler_kontext_bis_jetzt_hat_sich,A2,Minimaler Kontext,10,1,"Gesucht ist eine Person, nicht ein Ding.",A2-logic,,ready,,
logik500_0162,2026-02-14T15:21:00Z,,"Nur Kontext zählt: Ich habe den Bericht gelesen, aber ___ verstanden.",kein,nichts,nicht,nie,1,nichts,Die Bedeutung betrifft den Umfang des Verstehens.,logik500_0162_a2_d10_nichts_nur_kontext_zaehlt_ich_habe_den_beri,A2,Minimaler Kontext,10,1,Die Bedeutung betrifft den Umfang des Verstehens.,A2-logic,,ready,,
logik500_0163,2026-02-14T15:23:00Z,,Nur Kontext zählt: Wir haben ___ offenen Punkte mehr.,nie,keine,nichts,nicht,1,keine,Hier wird ein Pluralnomen verneint.,logik500_0163_a2_d10_keine_nur_kontext_zaehlt_wir_haben_offenen,A2,Minimaler Kontext,10,1,Hier wird ein Pluralnomen verneint.,A2-logic,,ready,,
logik500_0164,2026-02-14T15:25:00Z,,"Nur Kontext zählt: Sie hat heute ___ Stimme, deshalb schreibt sie nur.",nicht,keine,nie,nichts,1,keine,"Die Aussage verneint das Nomen ""Stimme"".",logik500_0164_a2_d10_keine_nur_kontext_zaehlt_sie_hat_heute_sti,A2,Minimaler Kontext,10,1,"Die Aussage verneint das Nomen ""Stimme"".",A2-logic,,ready,,
logik500_0165,2026-02-14T15:27:00Z,,Nur Kontext zählt: Bis jetzt hat sich ___ beschwert.,nicht,kein,nichts,niemand,3,niemand,"Gesucht ist eine Person, nicht ein Ding.",logik500_0165_a2_d10_niemand_nur_kontext_zaehlt_bis_jetzt_hat_sic,A2,Minimaler Kontext,10,1,"Gesucht ist eine Person, nicht ein Ding.",A2-logic,,ready,,
logik500_0166,2026-03-01T14:00:00Z,,"Minimaler Kontext: Die Aufgabe ist ___ erledigt, wir brauchen noch zehn Minuten.",kein,noch nicht,nichts,nie,1,noch nicht,Der Zustand ist bis jetzt nicht erreicht.,logik500_0166_s2_a2_d10_noch_nicht_minimaler_kontext_die_aufgabe_ist_erledigt,A2,Minimaler Kontext,10,1,Der Zustand ist bis jetzt nicht erreicht.,A2-logic-s2,,ready,,
logik500_0167,2026-03-01T14:01:00Z,,"Nur ein Signalwort passt: Die Aufgabe ist ___ erledigt, wir brauchen noch zehn Minuten.",nie,kein,nichts,noch nicht,3,noch nicht,Der Zustand ist bis jetzt nicht erreicht.,logik500_0167_s2_a2_d10_noch_nicht_nur_ein_signalwort_passt_die_aufgabe_ist_e,A2,Minimaler Kontext,10,1,Der Zustand ist bis jetzt nicht erreicht.,A2-logic-s2,,ready,,
logik500_0168,2026-03-01T14:02:00Z,,Minimaler Kontext: Im Bericht steht ___ über die Ursache.,nie,nicht,nichts,kein,2,nichts,Es fehlt Information.,logik500_0168_s2_a2_d10_nichts_minimaler_kontext_im_bericht_steht_ueber_d,A2,Minimaler Kontext,10,1,Es fehlt Information.,A2-logic-s2,,ready,,
logik500_0169,2026-03-01T14:03:00Z,,Nur ein Signalwort passt: Im Bericht steht ___ über die Ursache.,kein,nichts,nicht,nie,1,nichts,Es fehlt Information.,logik500_0169_s2_a2_d10_nichts_nur_ein_signalwort_passt_im_bericht_steht_,A2,Minimaler Kontext,10,1,Es fehlt Information.,A2-logic-s2,,ready,,
logik500_0170,2026-03-01T14:04:00Z,,Minimaler Kontext: Bis jetzt hat sich ___ gemeldet.,nichts,kein,nicht,niemand,3,niemand,Gesucht ist eine Person.,logik500_0170_s2_a2_d10_niemand_minimaler_kontext_bis_jetzt_hat_sich_gemel,A2,Minimaler Kontext,10,1,Gesucht ist eine Person.,A2-logic-s2,,ready,,
logik500_0171,2026-03-01T14:05:00Z,,Nur ein Signalwort passt: Bis jetzt hat sich ___ gemeldet.,kein,nicht,niemand,nichts,2,niemand,Gesucht ist eine Person.,logik500_0171_s2_a2_d10_niemand_nur_ein_signalwort_passt_bis_jetzt_hat_sic,A2,Minimaler Kontext,10,1,Gesucht ist eine Person.,A2-logic-s2,,ready,,
logik500_0172,2026-03-01T14:06:00Z,,Minimaler Kontext: Wir haben heute ___ freien Termin mehr.,nie,keinen,nichts,nicht,1,keinen,Das Nomen „Termin“ wird verneint.,logik500_0172_s2_a2_d10_keinen_minimaler_kontext_wir_haben_heute_freien_t,A2,Minimaler Kontext,10,1,Das Nomen „Termin“ wird verneint.,A2-logic-s2,,ready,,
logik500_0173,2026-03-01T14:07:00Z,,Nur ein Signalwort passt: Wir haben heute ___ freien Termin mehr.,nie,nicht,nichts,keinen,3,keinen,Das Nomen „Termin“ wird verneint.,logik500_0173_s2_a2_d10_keinen_nur_ein_signalwort_passt_wir_haben_heute_f,A2,Minimaler Kontext,10,1,Das Nomen „Termin“ wird verneint.,A2-logic-s2,,ready,,
logik500_0174,2026-03-01T14:08:00Z,,"Minimaler Kontext: Sie hat den Text gelesen, aber ___ verstanden.",nie,kein,nichts,nicht,2,nichts,Es geht um den Umfang des Verstehens.,logik500_0174_s2_a2_d10_nichts_minimaler_kontext_sie_hat_den_text_gelesen,A2,Minimaler Kontext,10,1,Es geht um den Umfang des Verstehens.,A2-logic-s2,,ready,,
logik500_0175,2026-03-01T14:09:00Z,,"Nur ein Signalwort passt: Sie hat den Text gelesen, aber ___ verstanden.",kein,nichts,nicht,nie,1,nichts,Es geht um den Umfang des Verstehens.,logik500_0175_s2_a2_d10_nichts_nur_ein_signalwort_passt_sie_hat_den_text_,A2,Minimaler Kontext,10,1,Es geht um den Umfang des Verstehens.,A2-logic-s2,,ready,,
logik500_0176,2026-03-01T14:10:00Z,,Minimaler Kontext: Er antwortet auf solche Mails fast ___.,nie,kein,nichts,nicht,0,nie,Hier zählt Häufigkeit.,logik500_0176_s2_a2_d10_nie_minimaler_kontext_er_antwortet_auf_solche_,A2,Minimaler Kontext,10,1,Hier zählt Häufigkeit.,A2-logic-s2,,ready,,
logik500_0177,2026-03-01T14:11:00Z,,Nur ein Signalwort passt: Er antwortet auf solche Mails fast ___.,nicht,kein,nichts,nie,3,nie,Hier zählt Häufigkeit.,logik500_0177_s2_a2_d10_nie_nur_ein_signalwort_passt_er_antwortet_auf_,A2,Minimaler Kontext,10,1,Hier zählt Häufigkeit.,A2-logic-s2,,ready,,
logik500_0178,2026-03-01T14:12:00Z,,Minimaler Kontext: Ohne Karte finden wir den Weg ___.,nie,nicht,kein,nichts,1,nicht,Verneint wird das Verb/Prädikat.,logik500_0178_s2_a2_d10_nicht_minimaler_kontext_ohne_karte_finden_wir_de,A2,Minimaler Kontext,10,1,Verneint wird das Verb/Prädikat.,A2-logic-s2,,ready,,
logik500_0179,2026-03-01T14:13:00Z,,Nur ein Signalwort passt: Ohne Karte finden wir den Weg ___.,nichts,kein,nie,nicht,3,nicht,Verneint wird das Verb/Prädikat.,logik500_0179_s2_a2_d10_nicht_nur_ein_signalwort_passt_ohne_karte_finden,A2,Minimaler Kontext,10,1,Verneint wird das Verb/Prädikat.,A2-logic-s2,,ready,,
logik500_0180,2026-03-01T14:14:00Z,,Minimaler Kontext: Für dieses Formular habe ich ___ passenden Nachweis.,nichts,nie,nicht,keinen,3,keinen,Ein Objekt-Nomen wird verneint.,logik500_0180_s2_a2_d10_keinen_minimaler_kontext_fuer_dieses_formular_hab,A2,Minimaler Kontext,10,1,Ein Objekt-Nomen wird verneint.,A2-logic-s2,,ready,,
logik500_0181,2026-03-01T14:15:00Z,,Nur ein Signalwort passt: Für dieses Formular habe ich ___ passenden Nachweis.,keinen,nie,nicht,nichts,0,keinen,Ein Objekt-Nomen wird verneint.,logik500_0181_s2_a2_d10_keinen_nur_ein_signalwort_passt_fuer_dieses_formu,A2,Minimaler Kontext,10,1,Ein Objekt-Nomen wird verneint.,A2-logic-s2,,ready,,
logik500_0182,2026-03-01T14:16:00Z,,"Minimaler Kontext: Die Erklärung ist klar, aber für mich ___ vollständig.",nie,nichts,kein,nicht,3,nicht,Ein Adjektiv wird verneint.,logik500_0182_s2_a2_d10_nicht_minimaler_kontext_die_erklaerung_ist_klar_,A2,Minimaler Kontext,10,1,Ein Adjektiv wird verneint.,A2-logic-s2,,ready,,
logik500_0183,2026-03-01T14:17:00Z,,"Nur ein Signalwort passt: Die Erklärung ist klar, aber für mich ___ vollständig.",nichts,nie,kein,nicht,3,nicht,Ein Adjektiv wird verneint.,logik500_0183_s2_a2_d10_nicht_nur_ein_signalwort_passt_die_erklaerung_is,A2,Minimaler Kontext,10,1,Ein Adjektiv wird verneint.,A2-logic-s2,,ready,,
logik500_0184,2026-03-01T14:18:00Z,,Minimaler Kontext: Im Protokoll fehlt ___ konkrete Zahl.,eine,nie,nicht,keine,0,eine,Hier wird Existenz einer Zahl ausgedrückt.,logik500_0184_s2_a2_d10_eine_minimaler_kontext_im_protokoll_fehlt_konkr,A2,Minimaler Kontext,10,1,Hier wird Existenz einer Zahl ausgedrückt.,A2-logic-s2,,ready,,
logik500_0185,2026-03-01T14:19:00Z,,Nur ein Signalwort passt: Im Protokoll fehlt ___ konkrete Zahl.,nie,nicht,keine,eine,3,eine,Hier wird Existenz einer Zahl ausgedrückt.,logik500_0185_s2_a2_d10_eine_nur_ein_signalwort_passt_im_protokoll_fehl,A2,Minimaler Kontext,10,1,Hier wird Existenz einer Zahl ausgedrückt.,A2-logic-s2,,ready,,
logik500_0186,2026-02-14T09:12:00Z,,"Die Aufgabe war schwer, aber am Ende konnte ich sie ___.",lösen,gießen,falten,streichen,0,lösen,Ein Problem kann man lösen.,logik500_0186_a2_d1_loesen_die_aufgabe_war_schwer_aber_am_ende_,A2,Semantische Logik,1,10,Ein Problem kann man lösen.,A2-logic,,ready,,
logik500_0187,2026-02-14T09:13:00Z,,Was passt inhaltlich? Vor einer großen Ausgabe sollte man Preise ___.,vergleichen,verstecken,vergessen,verbrennen,0,vergleichen,Beim Kauf ist Vergleichen logisch sinnvoll.,logik500_0187_a2_d1_vergleichen_was_passt_inhaltlich_vor_einer_gross,A2,Semantische Logik,1,10,Beim Kauf ist Vergleichen logisch sinnvoll.,A2-logic,,ready,,
logik500_0188,2026-02-14T09:14:00Z,,"Die Information ist wichtig, deshalb solltest du mich sofort ___.",informieren,sortieren,rasieren,fotografieren,0,informieren,"Bei wichtiger Information passt ""informieren"".",logik500_0188_a2_d1_informieren_die_information_ist_wichtig_deshalb_,A2,Semantische Logik,1,10,"Bei wichtiger Information passt ""informieren"".",A2-logic,,ready,,
logik500_0189,2026-02-14T09:15:00Z,,"Was passt inhaltlich? Wir haben zu wenig Zeit, wir müssen den Prozess ___.",vereinfachen,vergraben,verdunkeln,verzieren,0,vereinfachen,Wenig Zeit verlangt eine Vereinfachung.,logik500_0189_a2_d1_vereinfachen_was_passt_inhaltlich_wir_haben_zu_we,A2,Semantische Logik,1,10,Wenig Zeit verlangt eine Vereinfachung.,A2-logic,,ready,,
logik500_0190,2026-02-14T09:16:00Z,,"Die Beschreibung ist unklar, wir sollten sie ___.",präzisieren,wiegen,trocknen,parken,0,präzisieren,Unklare Aussagen präzisiert man.,logik500_0190_a2_d1_praezisieren_die_beschreibung_ist_unklar_wir_soll,A2,Semantische Logik,1,10,Unklare Aussagen präzisiert man.,A2-logic,,ready,,
logik500_0191,2026-02-14T09:17:00Z,,"Was passt inhaltlich? Das Budget ist knapp, daher müssen wir Kosten ___.",heilen,falten,schälen,senken,3,senken,Bei knappem Budget ist Kosten senken logisch.,logik500_0191_a2_d1_senken_was_passt_inhaltlich_das_budget_ist_,A2,Semantische Logik,1,10,Bei knappem Budget ist Kosten senken logisch.,A2-logic,,ready,,
logik500_0192,2026-02-14T09:18:00Z,,"Der Plan klingt gut, aber ist er auch ___.",laut,nass,realistisch,rechteckig,2,realistisch,Hier wird die Umsetzbarkeit bewertet.,logik500_0192_a2_d1_realistisch_der_plan_klingt_gut_aber_ist_er_auch,A2,Semantische Logik,1,10,Hier wird die Umsetzbarkeit bewertet.,A2-logic,,ready,,
logik500_0193,2026-02-14T09:19:00Z,,"Was passt inhaltlich? Bevor wir entscheiden, sollten wir alle Daten ___.",braten,prüfen,kleben,schneiden,1,prüfen,Vor Entscheidungen prüft man Daten.,logik500_0193_a2_d1_pruefen_was_passt_inhaltlich_bevor_wir_entsc,A2,Semantische Logik,1,10,Vor Entscheidungen prüft man Daten.,A2-logic,,ready,,
logik500_0194,2026-02-14T09:20:00Z,,Nach mehreren Versuchen konnte ich das Rätsel endlich ___.,streichen,falten,gießen,lösen,3,lösen,Ein Problem kann man lösen.,logik500_0194_a2_d1_loesen_was_passt_logisch_die_aufgabe_war_sc,A2,Semantische Logik,1,10,Ein Problem kann man lösen.,A2-logic,,ready,,
logik500_0195,2026-02-14T09:21:00Z,,Vor einem teuren Kauf sollte man Angebote gründlich ___.,verbrennen,vergleichen,vergessen,verstecken,1,vergleichen,Beim Kauf ist Vergleichen logisch sinnvoll.,logik500_0195_a2_d1_vergleichen_inhaltlich_logisch_vor_einer_grossen,A2,Semantische Logik,1,10,Beim Kauf ist Vergleichen logisch sinnvoll.,A2-logic,,ready,,
logik500_0196,2026-02-14T09:22:00Z,,"Wenn sich der Termin ändert, solltest du mich sofort ___.",informieren,fotografieren,sortieren,rasieren,0,informieren,"Bei wichtiger Information passt ""informieren"".",logik500_0196_a2_d1_informieren_was_passt_logisch_die_information_is,A2,Semantische Logik,1,10,"Bei wichtiger Information passt ""informieren"".",A2-logic,,ready,,
logik500_0197,2026-02-14T09:23:00Z,,Der Ablauf ist zu kompliziert; wir müssen den Prozess ___.,vereinfachen,verzieren,vergraben,verdunkeln,0,vereinfachen,Wenig Zeit verlangt eine Vereinfachung.,logik500_0197_a2_d1_vereinfachen_inhaltlich_logisch_wir_haben_zu_weni,A2,Semantische Logik,1,10,Wenig Zeit verlangt eine Vereinfachung.,A2-logic,,ready,,
logik500_0198,2026-02-14T09:24:00Z,,"Die Anleitung ist missverständlich, wir sollten sie genauer ___.",wiegen,präzisieren,parken,trocknen,1,präzisieren,Unklare Aussagen präzisiert man.,logik500_0198_a2_d1_praezisieren_was_passt_logisch_die_beschreibung_i,A2,Semantische Logik,1,10,Unklare Aussagen präzisiert man.,A2-logic,,ready,,
logik500_0199,2026-02-14T09:25:00Z,,"Wenn die Einnahmen sinken, müssen wir die Kosten ___.",schälen,falten,heilen,senken,3,senken,Bei knappem Budget ist Kosten senken logisch.,logik500_0199_a2_d1_senken_inhaltlich_logisch_das_budget_ist_kn,A2,Semantische Logik,1,10,Bei knappem Budget ist Kosten senken logisch.,A2-logic,,ready,,
logik500_0200,2026-02-14T09:26:00Z,,"Der Plan klingt gut, aber ist er auch wirklich ___?",laut,rechteckig,nass,realistisch,3,realistisch,Hier wird die Umsetzbarkeit bewertet.,logik500_0200_a2_d1_realistisch_was_passt_logisch_der_plan_klingt_gu,A2,Semantische Logik,1,10,Hier wird die Umsetzbarkeit bewertet.,A2-logic,,ready,,
logik500_0201,2026-02-14T09:27:00Z,,"Bevor wir entscheiden, sollten wir die Zahlen noch einmal ___.",braten,schneiden,kleben,prüfen,3,prüfen,Vor Entscheidungen prüft man Daten.,logik500_0201_a2_d1_pruefen_inhaltlich_logisch_bevor_wir_entsche,A2,Semantische Logik,1,10,Vor Entscheidungen prüft man Daten.,A2-logic,,ready,,
logik500_0202,2026-03-01T08:00:00Z,,"Was passt semantisch? Bevor wir das Projekt starten, müssen wir die Risiken ___.",waschen,zählen,sammeln,analysieren,3,analysieren,Vor dem Start analysiert man Risiken.,logik500_0202_s2_a2_d1_analysieren_was_passt_semantisch_bevor_wir_das_projekt,A2,Semantische Logik,1,10,Vor dem Start analysiert man Risiken.,A2-logic-s2,,ready,,
logik500_0203,2026-03-01T08:02:00Z,,"Was passt semantisch? Wenn ein Vertrag unklar ist, sollte man zuerst Rückfragen ___.",falten,legen,trinken,stellen,3,stellen,Bei Unklarheit stellt man Rückfragen.,logik500_0203_s2_a2_d1_stellen_was_passt_semantisch_wenn_ein_vertrag_unkl,A2,Semantische Logik,1,10,Bei Unklarheit stellt man Rückfragen.,A2-logic-s2,,ready,,
logik500_0204,2026-03-01T08:04:00Z,,Was passt semantisch? Bei einem Fehler im System müssen wir die Ursache schnell ___.,malen,schneiden,tragen,finden,3,finden,Zur Lösung muss zuerst die Ursache gefunden werden.,logik500_0204_s2_a2_d1_finden_was_passt_semantisch_bei_einem_fehler_im_s,A2,Semantische Logik,1,10,Zur Lösung muss zuerst die Ursache gefunden werden.,A2-logic-s2,,ready,,
logik500_0205,2026-03-01T08:06:00Z,,Was passt semantisch? Für eine faire Entscheidung sollten wir alle Optionen ___.,schälen,vergessen,parken,abwägen,3,abwägen,Fairness braucht den Vergleich aller Optionen.,logik500_0205_s2_a2_d1_abwaegen_was_passt_semantisch_fuer_eine_faire_entsc,A2,Semantische Logik,1,10,Fairness braucht den Vergleich aller Optionen.,A2-logic-s2,,ready,,
logik500_0206,2026-03-01T08:08:00Z,,"Was passt semantisch? Wenn Daten fehlen, kann man die Aussage nicht sicher ___.",bügeln,bewerten,trocknen,kochen,1,bewerten,Ohne Daten kann man etwas nicht fundiert bewerten.,logik500_0206_s2_a2_d1_bewerten_was_passt_semantisch_wenn_daten_fehlen_kan,A2,Semantische Logik,1,10,Ohne Daten kann man etwas nicht fundiert bewerten.,A2-logic-s2,,ready,,
logik500_0207,2026-03-01T08:10:00Z,,"Was passt semantisch? Vor dem Termin ist es sinnvoll, die wichtigsten Punkte ___.",werfen,kleben,notieren,verstecken,2,notieren,"Notizen helfen, relevante Inhalte nicht zu vergessen.",logik500_0207_s2_a2_d1_notieren_was_passt_semantisch_vor_dem_termin_ist_es,A2,Semantische Logik,1,10,"Notizen helfen, relevante Inhalte nicht zu vergessen.",A2-logic-s2,,ready,,
logik500_0208,2026-03-01T08:12:00Z,,"Was passt semantisch? Wenn die Aufgabe zu groß wirkt, kann man sie in Schritte ___.",lachen,teilen,brennen,gießen,1,teilen,Komplexe Aufgaben werden durch Teilung machbar.,logik500_0208_s2_a2_d1_teilen_was_passt_semantisch_wenn_die_aufgabe_zu_g,A2,Semantische Logik,1,10,Komplexe Aufgaben werden durch Teilung machbar.,A2-logic-s2,,ready,,
logik500_0209,2026-03-01T08:14:00Z,,"Was passt semantisch? Um Missverständnisse zu vermeiden, sollten wir Begriffe klar ___.",definieren,reiten,stopfen,vergolden,0,definieren,Klare Definitionen vermeiden Mehrdeutigkeit.,logik500_0209_s2_a2_d1_definieren_was_passt_semantisch_um_missverstaendnisse,A2,Semantische Logik,1,10,Klare Definitionen vermeiden Mehrdeutigkeit.,A2-logic-s2,,ready,,
logik500_0210,2026-03-01T08:16:00Z,,"Was passt semantisch? Wenn ein Plan nicht funktioniert, muss man ihn flexibel ___.",verlieren,singen,frieren,anpassen,3,anpassen,Unpassende Pläne müssen angepasst werden.,logik500_0210_s2_a2_d1_anpassen_was_passt_semantisch_wenn_ein_plan_nicht_f,A2,Semantische Logik,1,10,Unpassende Pläne müssen angepasst werden.,A2-logic-s2,,ready,,
logik500_0211,2026-03-01T08:18:00Z,,Was passt semantisch? Für eine gute Zusammenarbeit sollten wir Informationen offen ___.,biegen,teilen,kaufen,trocknen,1,teilen,Transparenz braucht das Teilen von Informationen.,logik500_0211_s2_a2_d1_teilen_was_passt_semantisch_fuer_eine_gute_zusamm,A2,Semantische Logik,1,10,Transparenz braucht das Teilen von Informationen.,A2-logic-s2,,ready,,
logik500_0212,2026-02-14T09:52:00Z,,"Die Bahn streikt heute, ___ ich fahre mit dem Fahrrad zur Arbeit.",deshalb,oder,aber,trotzdem,0,deshalb,"Die Wahl folgt aus einer konkreten Situation, nicht aus einer Regel.",logik500_0212_a2_d2_deshalb_die_bahn_streikt_heute_ich_fahre_mit,A2,Situationslogik,2,6,"Die Wahl folgt aus einer konkreten Situation, nicht aus einer Regel.",A2-logic,,ready,,
logik500_0213,2026-02-14T09:53:00Z,,Der Termin wurde auf 8 Uhr vorverlegt. ___ ich stelle den Wecker früher.,oder,aber,darum,trotzdem,2,darum,"Die Wahl folgt aus einer konkreten Situation, nicht aus einer Regel.",logik500_0213_a2_d2_darum_der_termin_wurde_auf_8_uhr_vorverleg,A2,Situationslogik,2,6,"Die Wahl folgt aus einer konkreten Situation, nicht aus einer Regel.",A2-logic,,ready,,
logik500_0214,2026-02-14T09:54:00Z,,"Der Drucker zeigt Papierstau, ___ ich öffne erst die Klappe.",daher,trotzdem,aber,oder,0,daher,"Die Wahl folgt aus einer konkreten Situation, nicht aus einer Regel.",logik500_0214_a2_d2_daher_der_drucker_zeigt_papierstau_ich_oef,A2,Situationslogik,2,6,"Die Wahl folgt aus einer konkreten Situation, nicht aus einer Regel.",A2-logic,,ready,,
logik500_0215,2026-02-14T09:55:00Z,,Die Frist endet heute. ___ wir senden die Unterlagen sofort.,oder,aber,deshalb,trotzdem,2,deshalb,"Die Wahl folgt aus einer konkreten Situation, nicht aus einer Regel.",logik500_0215_a2_d2_deshalb_die_frist_endet_heute_wir_senden_die,A2,Situationslogik,2,6,"Die Wahl folgt aus einer konkreten Situation, nicht aus einer Regel.",A2-logic,,ready,,
logik500_0216,2026-02-14T09:56:00Z,,"Das Navi meldet Stau auf der A3, ___ wir nehmen die Umleitung.",oder,darum,trotzdem,aber,1,darum,"Die Wahl folgt aus einer konkreten Situation, nicht aus einer Regel.",logik500_0216_a2_d2_darum_das_navi_meldet_stau_auf_der_a3_wir_,A2,Situationslogik,2,6,"Die Wahl folgt aus einer konkreten Situation, nicht aus einer Regel.",A2-logic,,ready,,
