quiz_id,created_at,published_at,question,option_1,option_2,option_3,option_4,correct_option_id,correct_answer,explanation,key,level,category,logic_domain,logic_domain_secondary,core_reason,difficulty_tag,message_id,status,audio_text,audio_file_id
logik500_0287,2026-02-14T13:55:00Z,,Ich sichere alle Dateien. ___ starte ich das Update.,aber,deshalb,danach,trotzdem,2,danach,"Entscheidend ist die zeitliche Reihenfolge, nicht Grammatikregeln.",logik500_0287_a2_d8_danach_ich_sichere_alle_dateien_starte_ich_,A2,Zeitlogik,8,5,"Entscheidend ist die zeitliche Reihenfolge, nicht Grammatikregeln.",A2-logic,,ready,,
logik500_0288,2026-02-14T13:56:00Z,,"Wir klären offene Fragen, ___ beginnt die Präsentation.",deshalb,anschließend,aber,trotzdem,1,anschließend,"Entscheidend ist die zeitliche Reihenfolge, nicht Grammatikregeln.",logik500_0288_a2_d8_anschliessend_wir_klaeren_offene_fragen_beginnt_di,A2,Zeitlogik,8,5,"Entscheidend ist die zeitliche Reihenfolge, nicht Grammatikregeln.",A2-logic,,ready,,
logik500_0289,2026-02-14T13:57:00Z,,Er liest den Vertrag. ___ unterschreibt er.,danach,deshalb,trotzdem,aber,0,danach,"Entscheidend ist die zeitliche Reihenfolge, nicht Grammatikregeln.",logik500_0289_a2_d8_danach_er_liest_den_vertrag_unterschreibt_e,A2,Zeitlogik,8,5,"Entscheidend ist die zeitliche Reihenfolge, nicht Grammatikregeln.",A2-logic,,ready,,
logik500_0290,2026-02-14T13:58:00Z,,"Ich lade die Unterlagen hoch, ___ sende ich den Link.",anschließend,deshalb,trotzdem,aber,0,anschließend,"Entscheidend ist die zeitliche Reihenfolge, nicht Grammatikregeln.",logik500_0290_a2_d8_anschliessend_ich_lade_die_unterlagen_hoch_sende_i,A2,Zeitlogik,8,5,"Entscheidend ist die zeitliche Reihenfolge, nicht Grammatikregeln.",A2-logic,,ready,,
logik500_0291,2026-02-14T13:59:00Z,,Wir testen die neue Version. ___ geben wir sie frei.,deshalb,danach,aber,trotzdem,1,danach,"Entscheidend ist die zeitliche Reihenfolge, nicht Grammatikregeln.",logik500_0291_a2_d8_danach_wir_testen_die_neue_version_geben_wi,A2,Zeitlogik,8,5,"Entscheidend ist die zeitliche Reihenfolge, nicht Grammatikregeln.",A2-logic,,ready,,
logik500_0292,2026-03-01T12:40:00Z,,"Zuerst prüfe ich meine Notizen, ___ schreibe ich die Zusammenfassung.",danach,aber,deshalb,trotzdem,0,danach,Die zeitliche Reihenfolge muss konsistent bleiben.,logik500_0292_s2_a2_d8_danach_zuerst_pruefe_ich_meine_notizen_schreibe_i,A2,Zeitlogik,8,5,Die zeitliche Reihenfolge muss konsistent bleiben.,A2-logic-s2,,ready,,
logik500_0293,2026-03-01T12:42:00Z,,"Wir sammeln alle Fragen, ___ beantworten wir sie im Block.",deshalb,anschließend,trotzdem,aber,1,anschließend,Die zeitliche Reihenfolge muss konsistent bleiben.,logik500_0293_s2_a2_d8_anschliessend_wir_sammeln_alle_fragen_beantworten_wir_si,A2,Zeitlogik,8,5,Die zeitliche Reihenfolge muss konsistent bleiben.,A2-logic-s2,,ready,,
logik500_0294,2026-03-01T12:44:00Z,,"Ich lade die Daten herunter, ___ öffne ich die Analyse.",deshalb,danach,trotzdem,aber,1,danach,Die zeitliche Reihenfolge muss konsistent bleiben.,logik500_0294_s2_a2_d8_danach_ich_lade_die_daten_herunter_oeffne_ich_die,A2,Zeitlogik,8,5,Die zeitliche Reihenfolge muss konsistent bleiben.,A2-logic-s2,,ready,,
logik500_0295,2026-03-01T12:46:00Z,,"Sie liest den Vertrag komplett, ___ unterschreibt sie.",anschließend,deshalb,trotzdem,aber,0,anschließend,Die zeitliche Reihenfolge muss konsistent bleiben.,logik500_0295_s2_a2_d8_anschliessend_sie_liest_den_vertrag_komplett_unterschrei,A2,Zeitlogik,8,5,Die zeitliche Reihenfolge muss konsistent bleiben.,A2-logic-s2,,ready,,
logik500_0296,2026-03-01T12:48:00Z,,"Wir aktualisieren erst die Software, ___ starten wir den Rechner neu.",danach,trotzdem,deshalb,aber,0,danach,Die zeitliche Reihenfolge muss konsistent bleiben.,logik500_0296_s2_a2_d8_danach_wir_aktualisieren_erst_die_software_starte,A2,Zeitlogik,8,5,Die zeitliche Reihenfolge muss konsistent bleiben.,A2-logic-s2,,ready,,
logik500_0297,2026-03-01T12:50:00Z,,"Ich sortiere zuerst die Belege, ___ übertrage ich die Zahlen.",anschließend,trotzdem,aber,deshalb,0,anschließend,Die zeitliche Reihenfolge muss konsistent bleiben.,logik500_0297_s2_a2_d8_anschliessend_ich_sortiere_zuerst_die_belege_uebertrage_,A2,Zeitlogik,8,5,Die zeitliche Reihenfolge muss konsistent bleiben.,A2-logic-s2,,ready,,
logik500_0298,2026-03-01T12:52:00Z,,"Wir prüfen die Verfügbarkeit, ___ bestellen wir die Geräte.",trotzdem,danach,aber,deshalb,1,danach,Die zeitliche Reihenfolge muss konsistent bleiben.,logik500_0298_s2_a2_d8_danach_wir_pruefen_die_verfuegbarkeit_bestellen_w,A2,Zeitlogik,8,5,Die zeitliche Reihenfolge muss konsistent bleiben.,A2-logic-s2,,ready,,
logik500_0299,2026-03-01T12:54:00Z,,"Er erstellt erst einen Entwurf, ___ holt er Feedback ein.",deshalb,aber,anschließend,trotzdem,2,anschließend,Die zeitliche Reihenfolge muss konsistent bleiben.,logik500_0299_s2_a2_d8_anschliessend_er_erstellt_erst_einen_entwurf_holt_er_fee,A2,Zeitlogik,8,5,Die zeitliche Reihenfolge muss konsistent bleiben.,A2-logic-s2,,ready,,
logik500_0300,2026-03-01T12:56:00Z,,"Ich kläre die offenen Punkte, ___ sende ich das Protokoll.",trotzdem,danach,deshalb,aber,1,danach,Die zeitliche Reihenfolge muss konsistent bleiben.,logik500_0300_s2_a2_d8_danach_ich_klaere_die_offenen_punkte_sende_ich_da,A2,Zeitlogik,8,5,Die zeitliche Reihenfolge muss konsistent bleiben.,A2-logic-s2,,ready,,
logik500_0301,2026-03-01T12:58:00Z,,"Wir testen lokal, ___ deployen wir in die Cloud.",anschließend,deshalb,aber,trotzdem,0,anschließend,Die zeitliche Reihenfolge muss konsistent bleiben.,logik500_0301_s2_a2_d8_anschliessend_wir_testen_lokal_deployen_wir_in_die_cloud,A2,Zeitlogik,8,5,Die zeitliche Reihenfolge muss konsistent bleiben.,A2-logic-s2,,ready,,
logik500_0302,2026-02-14T13:28:00Z,,"Wir definieren klare Kennzahlen, ___ den Fortschritt transparent zu machen.",obwohl,um,dass,weil,1,um,Die Option muss die Absicht der Handlung ausdrücken.,logik500_0302_b1_d7_um_wir_definieren_klare_kennzahlen_den_,B1,Absicht und Ziel,7,6,Die Option muss die Absicht der Handlung ausdrücken.,B1-logic,,ready,,
logik500_0303,2026-02-14T13:29:00Z,,Die Leitung informiert frühzeitig. ___ alle Teams rechtzeitig planen können.,weil,damit,um,obwohl,1,damit,Die Option muss die Absicht der Handlung ausdrücken.,logik500_0303_b1_d7_damit_die_leitung_informiert_fruehzeitig_a,B1,Absicht und Ziel,7,6,Die Option muss die Absicht der Handlung ausdrücken.,B1-logic,,ready,,
logik500_0304,2026-02-14T13:30:00Z,,"Ich formuliere die Ziele präzise, ___ Missverständnisse im Projekt zu vermeiden.",wenn,um,weil,dass,1,um,Die Option muss die Absicht der Handlung ausdrücken.,logik500_0304_b1_d7_um_ich_formuliere_die_ziele_praezise_mi,B1,Absicht und Ziel,7,6,Die Option muss die Absicht der Handlung ausdrücken.,B1-logic,,ready,,
logik500_0305,2026-02-14T13:31:00Z,,Wir verteilen Rollen klar. ___ die Verantwortung nachvollziehbar bleibt.,weil,obwohl,damit,um,2,damit,Die Option muss die Absicht der Handlung ausdrücken.,logik500_0305_b1_d7_damit_wir_verteilen_rollen_klar_die_verant,B1,Absicht und Ziel,7,6,Die Option muss die Absicht der Handlung ausdrücken.,B1-logic,,ready,,
logik500_0306,2026-02-14T13:32:00Z,,"Das Team übt den Pitch mehrfach, ___ im Termin souverän aufzutreten.",um,weil,falls,dass,0,um,Die Option muss die Absicht der Handlung ausdrücken.,logik500_0306_b1_d7_um_das_team_uebt_den_pitch_mehrfach_im_,B1,Absicht und Ziel,7,6,Die Option muss die Absicht der Handlung ausdrücken.,B1-logic,,ready,,
logik500_0307,2026-02-14T13:33:00Z,,Wir halten Rückfragen offen. ___ kritische Punkte früh sichtbar werden.,damit,um,weil,während,0,damit,Die Option muss die Absicht der Handlung ausdrücken.,logik500_0307_b1_d7_damit_wir_halten_rueckfragen_offen_kritisc,B1,Absicht und Ziel,7,6,Die Option muss die Absicht der Handlung ausdrücken.,B1-logic,,ready,,
logik500_0308,2026-03-01T12:20:00Z,,"Wir definieren Messgrößen frühzeitig, ___ den Fortschritt objektiv zu steuern.",um,dass,weil,obwohl,0,um,Messgrößen dienen einem Steuerungsziel.,logik500_0308_s2_b1_d7_um_wir_definieren_messgroessen_fruehzeitig_de,B1,Absicht und Ziel,7,6,Messgrößen dienen einem Steuerungsziel.,B1-logic-s2,,ready,,
logik500_0309,2026-03-01T12:22:00Z,,"Die Leitung kommuniziert transparent, ___ alle Bereiche verlässlich planen können.",damit,obwohl,weil,um,0,damit,Transparenz verfolgt Planbarkeit als Ziel.,logik500_0309_s2_b1_d7_damit_die_leitung_kommuniziert_transparent_alle_,B1,Absicht und Ziel,7,6,Transparenz verfolgt Planbarkeit als Ziel.,B1-logic-s2,,ready,,
logik500_0310,2026-03-01T12:24:00Z,,"Ich dokumentiere Entscheidungen sofort, ___ spätere Unklarheiten zu vermeiden.",um,weil,wenn,dass,0,um,Dokumentation dient der Prävention.,logik500_0310_s2_b1_d7_um_ich_dokumentiere_entscheidungen_sofort_spa,B1,Absicht und Ziel,7,6,Dokumentation dient der Prävention.,B1-logic-s2,,ready,,
logik500_0311,2026-03-01T12:26:00Z,,"Wir strukturieren die Agenda klar, ___ die Diskussion fokussiert bleibt.",obwohl,um,damit,weil,2,damit,Struktur sichert Diskussionsziel.,logik500_0311_s2_b1_d7_damit_wir_strukturieren_die_agenda_klar_die_disk,B1,Absicht und Ziel,7,6,Struktur sichert Diskussionsziel.,B1-logic-s2,,ready,,
logik500_0312,2026-03-01T12:28:00Z,,"Das Team übt den Pitch wiederholt, ___ im Termin überzeugend aufzutreten.",weil,dass,falls,um,3,um,Übung hat einen klaren Auftrittszweck.,logik500_0312_s2_b1_d7_um_das_team_uebt_den_pitch_wiederholt_im_term,B1,Absicht und Ziel,7,6,Übung hat einen klaren Auftrittszweck.,B1-logic-s2,,ready,,
logik500_0313,2026-03-01T12:30:00Z,,"Wir benennen Risiken explizit, ___ früh Gegenmaßnahmen planen zu können.",weil,um,obwohl,dass,1,um,Benennen von Risiken dient der Vorbereitung.,logik500_0313_s2_b1_d7_um_wir_benennen_risiken_explizit_frueh_gegenm,B1,Absicht und Ziel,7,6,Benennen von Risiken dient der Vorbereitung.,B1-logic-s2,,ready,,
logik500_0314,2026-03-01T12:32:00Z,,"Sie priorisieren Kernaufgaben zuerst, ___ das Quartalsziel erreichbar bleibt.",weil,obwohl,damit,um,2,damit,Priorisierung verfolgt ein strategisches Ziel.,logik500_0314_s2_b1_d7_damit_sie_priorisieren_kernaufgaben_zuerst_das_q,B1,Absicht und Ziel,7,6,Priorisierung verfolgt ein strategisches Ziel.,B1-logic-s2,,ready,,
logik500_0315,2026-03-01T12:34:00Z,,"Wir halten Feedbackrunden kurz und regelmäßig, ___ Anpassungen früh sichtbar werden.",damit,um,wenn,weil,0,damit,Regelmäßiges Feedback dient frühzeitiger Korrektur.,logik500_0315_s2_b1_d7_damit_wir_halten_feedbackrunden_kurz_und_regelma,B1,Absicht und Ziel,7,6,Regelmäßiges Feedback dient frühzeitiger Korrektur.,B1-logic-s2,,ready,,
logik500_0316,2026-03-01T12:36:00Z,,"Ich formuliere die Anforderungen präzise, ___ die Umsetzung effizient zu halten.",um,dass,obwohl,weil,0,um,Präzision hat Effizienz als Zweck.,logik500_0316_s2_b1_d7_um_ich_formuliere_die_anforderungen_praezise_,B1,Absicht und Ziel,7,6,Präzision hat Effizienz als Zweck.,B1-logic-s2,,ready,,
logik500_0317,2026-03-01T12:38:00Z,,"Wir stimmen Schnittstellen früh ab, ___ spätere Konflikte zu vermeiden.",um,dass,weil,wenn,0,um,Frühe Abstimmung dient der Konfliktvermeidung.,logik500_0317_s2_b1_d7_um_wir_stimmen_schnittstellen_frueh_ab_spaete,B1,Absicht und Ziel,7,6,Frühe Abstimmung dient der Konfliktvermeidung.,B1-logic-s2,,ready,,
logik500_0318,2026-02-14T11:28:00Z,,Das Team hat zu viele parallele Aufgaben. Welche Handlung ist hier logisch? ___.,wir streichen alle Pausen,wir setzen klare Prioritäten,wir wechseln den Teppich,wir bestellen Pizza,1,wir setzen klare Prioritäten,Alltagsnahe Handlungslogik entscheidet über die passende Option.,logik500_0318_b1_d4_wir_setzen_klare_prioritaeten_das_team_hat_zu_viele_parallele_aufg,B1,Alltagslogik,4,2,Alltagsnahe Handlungslogik entscheidet über die passende Option.,B1-logic,,ready,,
logik500_0319,2026-02-14T11:29:00Z,,Mehrere Aufgaben hängen voneinander ab. Sinnvoller nächster Schritt: ___.,wir halten zuerst Rücksprache,wir kaufen neue Stifte,wir löschen alle Mails,wir dekorieren das Büro,0,wir halten zuerst Rücksprache,Alltagsnahe Handlungslogik entscheidet über die passende Option.,logik500_0319_b1_d4_wir_halten_zuerst_ruecksprache_mehrere_aufgaben_haengen_voneinander,B1,Alltagslogik,4,2,Alltagsnahe Handlungslogik entscheidet über die passende Option.,B1-logic,,ready,,
logik500_0320,2026-02-14T11:30:00Z,,Der Ablauf erzeugt ständig Wartezeiten. Welche Handlung ist hier logisch? ___.,wir tauschen Tassen,wir verlängern die Musikpause,wir zählen Büroklammern,wir optimieren den Prozess,3,wir optimieren den Prozess,Alltagsnahe Handlungslogik entscheidet über die passende Option.,logik500_0320_b1_d4_wir_optimieren_den_prozess_der_ablauf_erzeugt_staendig_wartezei,B1,Alltagslogik,4,2,Alltagsnahe Handlungslogik entscheidet über die passende Option.,B1-logic,,ready,,
logik500_0321,2026-02-14T11:31:00Z,,Die Verantwortung ist im Projekt unklar. Sinnvoller nächster Schritt: ___.,wir klären die Zuständigkeiten,wir drucken Flyer,wir wechseln die Lampen,wir putzen den Flur,0,wir klären die Zuständigkeiten,Alltagsnahe Handlungslogik entscheidet über die passende Option.,logik500_0321_b1_d4_wir_klaeren_die_zustaendigkeiten_die_verantwortung_ist_im_projekt_unk,B1,Alltagslogik,4,2,Alltagsnahe Handlungslogik entscheidet über die passende Option.,B1-logic,,ready,,
logik500_0322,2026-02-14T11:32:00Z,,Das Budget wurde kurzfristig gekürzt. Welche Handlung ist hier logisch? ___.,wir buchen einen Ausflug,wir streichen die Wand,wir kaufen Poster,wir kalkulieren die Kosten neu,3,wir kalkulieren die Kosten neu,Alltagsnahe Handlungslogik entscheidet über die passende Option.,logik500_0322_b1_d4_wir_kalkulieren_die_kosten_neu_das_budget_wurde_kurzfristig_gekuerz,B1,Alltagslogik,4,2,Alltagsnahe Handlungslogik entscheidet über die passende Option.,B1-logic,,ready,,
logik500_0323,2026-02-14T11:33:00Z,,Die Rückmeldungen der Nutzer fehlen. Sinnvoller nächster Schritt: ___.,wir schließen das Fenster,wir bauen ein Regal,wir trocknen Ordner,wir holen gezielt Feedback ein,3,wir holen gezielt Feedback ein,Alltagsnahe Handlungslogik entscheidet über die passende Option.,logik500_0323_b1_d4_wir_holen_gezielt_feedback_ein_die_rueckmeldungen_der_nutzer_fehlen,B1,Alltagslogik,4,2,Alltagsnahe Handlungslogik entscheidet über die passende Option.,B1-logic,,ready,,
logik500_0324,2026-03-01T10:20:00Z,,Im Projekt fehlen klare Verantwortlichkeiten. Welche Handlung ist im Alltag professionell logisch? ___.,wir streichen die Bürowand neu,wir kaufen Pflanzen für den Flur,wir definieren Rollen und Zuständigkeiten transparent,wir wechseln die Kaffeemaschine,2,wir definieren Rollen und Zuständigkeiten transparent,Praktische Entscheidungslogik in realen Arbeitssituationen.,logik500_0324_s2_b1_d4_wir_definieren_rollen_und_zustaendigkeiten_im_projekt_fehlen_klare_verantwortlichkeit,B1,Alltagslogik,4,2,Praktische Entscheidungslogik in realen Arbeitssituationen.,B1-logic-s2,,ready,,
logik500_0325,2026-03-01T10:22:00Z,,Die Abstimmung zwischen Teams dauert zu lange. Welche Handlung ist im Alltag professionell logisch? ___.,wir zählen Ordner im Regal,wir vereinbaren feste Entscheidungsfenster,wir dekorieren den Meetingraum,wir löschen alte Screenshots,1,wir vereinbaren feste Entscheidungsfenster,Praktische Entscheidungslogik in realen Arbeitssituationen.,logik500_0325_s2_b1_d4_wir_vereinbaren_feste_entscheidungsfenster_die_abstimmung_zwischen_teams_dauert_zu_la,B1,Alltagslogik,4,2,Praktische Entscheidungslogik in realen Arbeitssituationen.,B1-logic-s2,,ready,,
logik500_0326,2026-03-01T10:24:00Z,,Die Qualität schwankt zwischen Lieferungen. Welche Handlung ist im Alltag professionell logisch? ___.,wir führen verbindliche Prüfstandards ein,wir bestellen neue Stühle,wir tauschen Wandfarben,wir machen längere Pausen,0,wir führen verbindliche Prüfstandards ein,Praktische Entscheidungslogik in realen Arbeitssituationen.,logik500_0326_s2_b1_d4_wir_fuehren_verbindliche_pruefstandards_ei_die_qualitaet_schwankt_zwischen_lieferunge,B1,Alltagslogik,4,2,Praktische Entscheidungslogik in realen Arbeitssituationen.,B1-logic-s2,,ready,,
logik500_0327,2026-03-01T10:26:00Z,,Nutzer melden wiederholt denselben Fehler. Welche Handlung ist im Alltag professionell logisch? ___.,wir drucken Poster,wir priorisieren den Bug im nächsten Sprint,wir verschieben alle Termine,wir ändern die Büromusik,1,wir priorisieren den Bug im nächsten Sprint,Praktische Entscheidungslogik in realen Arbeitssituationen.,logik500_0327_s2_b1_d4_wir_priorisieren_den_bug_im_naechsten_spri_nutzer_melden_wiederholt_denselben_fehler_,B1,Alltagslogik,4,2,Praktische Entscheidungslogik in realen Arbeitssituationen.,B1-logic-s2,,ready,,
logik500_0328,2026-03-01T10:28:00Z,,Die Einführung einer neuen Software stockt. Welche Handlung ist im Alltag professionell logisch? ___.,wir schließen die Küche früher,wir kaufen neue Lampen,wir planen gezielte Schulungen für das Team,wir sortieren Namensschilder,2,wir planen gezielte Schulungen für das Team,Praktische Entscheidungslogik in realen Arbeitssituationen.,logik500_0328_s2_b1_d4_wir_planen_gezielte_schulungen_fuer_das_te_die_einfuehrung_einer_neuen_software_stock,B1,Alltagslogik,4,2,Praktische Entscheidungslogik in realen Arbeitssituationen.,B1-logic-s2,,ready,,
logik500_0329,2026-03-01T10:30:00Z,,Die Reaktionszeit im Support ist zu hoch. Welche Handlung ist im Alltag professionell logisch? ___.,wir optimieren Übergaben und Ticketregeln,wir tauschen Tastaturen,wir ersetzen Wasserflaschen,wir streichen das Logo um,0,wir optimieren Übergaben und Ticketregeln,Praktische Entscheidungslogik in realen Arbeitssituationen.,logik500_0329_s2_b1_d4_wir_optimieren_uebergaben_und_ticketregeln_die_reaktionszeit_im_support_ist_zu_hoch_w,B1,Alltagslogik,4,2,Praktische Entscheidungslogik in realen Arbeitssituationen.,B1-logic-s2,,ready,,
logik500_0330,2026-03-01T10:31:00Z,,Die Reaktionszeit im Support ist zu hoch. Sinnvoller nächster Schritt im Team: ___.,wir ersetzen Wasserflaschen,wir optimieren Übergaben und Ticketregeln,wir streichen das Logo um,wir tauschen Tastaturen,1,wir optimieren Übergaben und Ticketregeln,Praktische Entscheidungslogik in realen Arbeitssituationen.,logik500_0330_s2_b1_d4_wir_optimieren_uebergaben_und_ticketregeln_die_reaktionszeit_im_support_ist_zu_hoch_s,B1,Alltagslogik,4,2,Praktische Entscheidungslogik in realen Arbeitssituationen.,B1-logic-s2,,ready,,
logik500_0331,2026-03-01T10:32:00Z,,Das Budget wurde für das Quartal reduziert. Welche Handlung ist im Alltag professionell logisch? ___.,wir ersetzen Türgriffe,wir priorisieren Maßnahmen mit hohem Nutzen,wir planen einen Ausflug,wir drucken mehr Flyer,1,wir priorisieren Maßnahmen mit hohem Nutzen,Praktische Entscheidungslogik in realen Arbeitssituationen.,logik500_0331_s2_b1_d4_wir_priorisieren_massnahmen_mit_hohem_nutz_das_budget_wurde_fuer_das_quartal_reduzier,B1,Alltagslogik,4,2,Praktische Entscheidungslogik in realen Arbeitssituationen.,B1-logic-s2,,ready,,
logik500_0332,2026-03-01T10:34:00Z,,Mehrere Stakeholder haben widersprüchliche Erwartungen. Welche Handlung ist im Alltag professionell logisch? ___.,wir moderieren einen gemeinsamen Klärungstermin,wir schließen den Konferenzraum,wir archivieren Visitenkarten,wir bestellen neue Pflanzen,0,wir moderieren einen gemeinsamen Klärungstermin,Praktische Entscheidungslogik in realen Arbeitssituationen.,logik500_0332_s2_b1_d4_wir_moderieren_einen_gemeinsamen_klaerungs_mehrere_stakeholder_haben_widerspruechlich,B1,Alltagslogik,4,2,Praktische Entscheidungslogik in realen Arbeitssituationen.,B1-logic-s2,,ready,,
logik500_0333,2026-03-01T10:36:00Z,,Die Projektziele wirken für neue Kolleginnen unklar. Welche Handlung ist im Alltag professionell logisch? ___.,wir ändern den Teppich,wir kaufen neue Tassen,wir erstellen eine kurze Zielübersicht,wir verschieben alle Pausen,2,wir erstellen eine kurze Zielübersicht,Praktische Entscheidungslogik in realen Arbeitssituationen.,logik500_0333_s2_b1_d4_wir_erstellen_eine_kurze_zieluebersicht_die_projektziele_wirken_fuer_neue_kollegin,B1,Alltagslogik,4,2,Praktische Entscheidungslogik in realen Arbeitssituationen.,B1-logic-s2,,ready,,
logik500_0334,2026-03-01T10:38:00Z,,Die Umsetzung verzögert sich durch Rückfragen. Welche Handlung ist im Alltag professionell logisch? ___.,wir reduzieren die Beleuchtung,wir wechseln das Türschild,wir räumen den Keller auf,wir dokumentieren Entscheidungen zentral,3,wir dokumentieren Entscheidungen zentral,Praktische Entscheidungslogik in realen Arbeitssituationen.,logik500_0334_s2_b1_d4_wir_dokumentieren_entscheidungen_zentral_die_umsetzung_verzoegert_sich_durch_rueckf,B1,Alltagslogik,4,2,Praktische Entscheidungslogik in realen Arbeitssituationen.,B1-logic-s2,,ready,,
logik500_0335,2026-02-14T12:48:00Z,,"Die Datengrundlage war konsistent, ___ die Prognose blieb stabil.",oder,trotzdem,aber,somit,3,somit,Nur eine Option bildet eine kausale Logikkette.,logik500_0335_b1_d6_somit_die_datengrundlage_war_konsistent_di,B1,Kausalität,6,2,Nur eine Option bildet eine kausale Logikkette.,B1-logic,,ready,,
logik500_0336,2026-02-14T12:49:00Z,,Die Kosten wurden transparent gemacht. ___ die Entscheidung war schneller möglich.,aber,daher,trotzdem,oder,1,daher,Nur eine Option bildet eine kausale Logikkette.,logik500_0336_b1_d6_daher_die_kosten_wurden_transparent_gemach,B1,Kausalität,6,2,Nur eine Option bildet eine kausale Logikkette.,B1-logic,,ready,,
logik500_0337,2026-02-14T12:50:00Z,,"Die Prioritäten waren eindeutig, ___ das Team arbeitete fokussierter.",trotzdem,oder,somit,aber,2,somit,Nur eine Option bildet eine kausale Logikkette.,logik500_0337_b1_d6_somit_die_prioritaeten_waren_eindeutig_das,B1,Kausalität,6,2,Nur eine Option bildet eine kausale Logikkette.,B1-logic,,ready,,
logik500_0338,2026-02-14T12:51:00Z,,Die Risiken wurden früh erkannt. ___ wir konnten rechtzeitig gegensteuern.,aber,trotzdem,daher,oder,2,daher,Nur eine Option bildet eine kausale Logikkette.,logik500_0338_b1_d6_daher_die_risiken_wurden_frueh_erkannt_wir,B1,Kausalität,6,2,Nur eine Option bildet eine kausale Logikkette.,B1-logic,,ready,,
logik500_0339,2026-02-14T12:52:00Z,,"Die Kommunikation lief über einen Kanal, ___ es gab weniger Missverständnisse.",oder,trotzdem,somit,aber,2,somit,Nur eine Option bildet eine kausale Logikkette.,logik500_0339_b1_d6_somit_die_kommunikation_lief_ueber_einen_k,B1,Kausalität,6,2,Nur eine Option bildet eine kausale Logikkette.,B1-logic,,ready,,
logik500_0340,2026-02-14T12:53:00Z,,Die Anforderungen wurden präzisiert. ___ die Umsetzung verlief effizienter.,daher,aber,oder,trotzdem,0,daher,Nur eine Option bildet eine kausale Logikkette.,logik500_0340_b1_d6_daher_die_anforderungen_wurden_praezisiert,B1,Kausalität,6,2,Nur eine Option bildet eine kausale Logikkette.,B1-logic,,ready,,
logik500_0341,2026-03-01T11:40:00Z,,"Die Qualitätskriterien waren vorab eindeutig, ___ die Abnahme verlief ohne Konflikte.",oder,aber,somit,dennoch,2,somit,Die zweite Aussage ist die logische Wirkung der ersten.,logik500_0341_s2_b1_d6_somit_die_qualitaetskriterien_waren_vorab_eindeu,B1,Kausalität,6,2,Die zweite Aussage ist die logische Wirkung der ersten.,B1-logic-s2,,ready,,
logik500_0342,2026-03-01T11:42:00Z,,"Das Team dokumentierte jede Entscheidung, ___ spätere Rückfragen ließen sich schnell klären.",aber,daher,oder,dennoch,1,daher,Die zweite Aussage ist die logische Wirkung der ersten.,logik500_0342_s2_b1_d6_daher_das_team_dokumentierte_jede_entscheidung_s,B1,Kausalität,6,2,Die zweite Aussage ist die logische Wirkung der ersten.,B1-logic-s2,,ready,,
logik500_0343,2026-03-01T11:44:00Z,,"Die Schnittstellen wurden früh abgestimmt, ___ die Integration lief reibungslos.",oder,aber,somit,dennoch,2,somit,Die zweite Aussage ist die logische Wirkung der ersten.,logik500_0343_s2_b1_d6_somit_die_schnittstellen_wurden_frueh_abgestimmt,B1,Kausalität,6,2,Die zweite Aussage ist die logische Wirkung der ersten.,B1-logic-s2,,ready,,
logik500_0344,2026-03-01T11:46:00Z,,"Risiken wurden bereits in der Planungsphase bewertet, ___ Gegenmaßnahmen standen rechtzeitig bereit.",aber,daher,oder,dennoch,1,daher,Die zweite Aussage ist die logische Wirkung der ersten.,logik500_0344_s2_b1_d6_daher_risiken_wurden_bereits_in_der_planungsphas,B1,Kausalität,6,2,Die zweite Aussage ist die logische Wirkung der ersten.,B1-logic-s2,,ready,,
logik500_0345,2026-03-01T11:48:00Z,,"Die Kommunikation erfolgte über klare Kanäle, ___ es gab weniger Informationsverluste.",aber,dennoch,somit,oder,2,somit,Die zweite Aussage ist die logische Wirkung der ersten.,logik500_0345_s2_b1_d6_somit_die_kommunikation_erfolgte_ueber_klare_kan,B1,Kausalität,6,2,Die zweite Aussage ist die logische Wirkung der ersten.,B1-logic-s2,,ready,,
logik500_0346,2026-03-01T11:50:00Z,,"Die Anforderungen wurden präzise priorisiert, ___ Ressourcen konnten gezielt eingesetzt werden.",aber,daher,dennoch,oder,1,daher,Die zweite Aussage ist die logische Wirkung der ersten.,logik500_0346_s2_b1_d6_daher_die_anforderungen_wurden_praezise_priorisi,B1,Kausalität,6,2,Die zweite Aussage ist die logische Wirkung der ersten.,B1-logic-s2,,ready,,
logik500_0347,2026-03-01T11:52:00Z,,"Alle Beteiligten arbeiteten mit derselben Datenbasis, ___ Entscheidungen blieben konsistent.",aber,dennoch,somit,oder,2,somit,Die zweite Aussage ist die logische Wirkung der ersten.,logik500_0347_s2_b1_d6_somit_alle_beteiligten_arbeiteten_mit_derselben_,B1,Kausalität,6,2,Die zweite Aussage ist die logische Wirkung der ersten.,B1-logic-s2,,ready,,
logik500_0348,2026-03-01T11:54:00Z,,"Der Rollout erfolgte in kleinen Schritten, ___ Probleme konnten früh korrigiert werden.",oder,aber,daher,dennoch,2,daher,Die zweite Aussage ist die logische Wirkung der ersten.,logik500_0348_s2_b1_d6_daher_der_rollout_erfolgte_in_kleinen_schritten_,B1,Kausalität,6,2,Die zweite Aussage ist die logische Wirkung der ersten.,B1-logic-s2,,ready,,
